text,dateNotBefore,dateNotAfter,avgDate,period
"– der Mann, er leidet trotzdem (wörtl.: außerdem, bekanntermaßen) daran;",-1580,-1539,-1560,Late Period
"Er hat veranlaßt, daß Thot die Gefolgsleute des Seth vor dir zurückweichen läßt.",-2345,-2323,-2334,Middle Kingdom
"Die Menschen aber verbergen sich, die Götter aber fliegen auf.",-2375,-2345,-2360,Middle Kingdom
Geschenk (für) den Palast (von) Aha,-2800,-2650,-2725,Old Kingdom
Du wirst durch es die $wrr.t$-Krone ergreifen bei den Göttern.,-2278,-2184,-2231,Middle Kingdom
"Daraufhin sagte Djedi das, was er als Zauber(sprüche) zu sagen pflegte.",-1580,-1539,-1560,Late Period
"Das Wehklagen, wie groß und wie viel!",-1939,-1760,-1850,New Kingdom
"""Mögest du nicht länger blind sein in ihrem Leib in diesem deinem Namen 'Keku'.""",-1580,-1539,-1560,Late Period
"So, wie Pe für mich gebaut wurde, so wurde Dep für mich gegründet.",-1939,-1630,-1785,New Kingdom
"(Austrocknungsmittel 2:) Unterägyptisches Salz, Fett des Steinbocks:",-1580,-1539,-1560,Late Period
"Sein Sohn, sein Geliebter, der Gutsverwalter und einzige Freund (des Königs) Chui.",-2345,-2181,-2263,Middle Kingdom
"Der Nomarch, Vorsteher der Expedition, der hohe Beamte und Hem-nisut (Siegler des Königs?), der Älteste des Palastes und Königssohn",-2686,-2613,-2650,Old Kingdom
"Mit dem Schlechten ist (man) zufrieden,",-1939,-1760,-1850,New Kingdom
"(Aber) wer seiner Leidenschaft gehorcht (wörtl.: auf seinen Bauch hört), er gehört dem Feind.",-1939,-1760,-1850,New Kingdom
"(Als) das Land sich erhellte, erreichte ich Peten.",-1939,-1760,-1850,New Kingdom
"Der Tausendfüßler wurde von dem Zum Haus Gehörigen geschlagen, der Zum Haus Gehörige wurde von dem Tausendfüßler geschlagen.",-2375,-2345,-2360,Middle Kingdom
Der Vorsteher des Leinenzeugs Seschem-nefer.,-2494,-2181,-2338,Middle Kingdom
"Nimm (aber/nur) an, wenn er dir (etwas) gibt!",-1939,-1760,-1850,New Kingdom
"Die vor dir sollen sich vor dir verbergen, die hinter dir sollen sich vor dir fürchten, wegen dieses deines Namens, den dein Vater Osiris für dich gemacht hat, (nämlich) 'Unterweltlicher Horus', 'Der sie schlägt', 'Der sie ertränkt(?)', 'Der sie wegfegt' - und du wirst sie schlagen, du wirst sie ertränken(?), du wirst sie wegfegen, am See, am Großen Grünen.",-2278,-2184,-2231,Middle Kingdom
"Ich bin es, der zu dir spricht.",-1939,-1760,-1850,New Kingdom
"Iri-pat, Größter der Sehenden, oberster Vorlesepriester der beiden Götter des Nestes des Umkreises",-2706,-2686,-2696,Old Kingdom
"(Ob) sie zum Himmel blickten, (oder ob) sie aufs Land blickten, ihre Herzen waren kühner als die von Löwen.",-1939,-1760,-1850,New Kingdom
"(So/aber eigentlich) erreicht er, daß er gibt (oder: daß er gegeben werden wird) an einen, den er nicht kennt.",-1939,-1760,-1850,New Kingdom
"(Denn) er hatte die Gewohnheit, sich dem See zuzuwenden.",-1939,-1760,-1850,New Kingdom
"Sie wird dich schützend umfassen und verhindern, daß du Mangel leidest.",-2321,-2287,-2304,Middle Kingdom
"Setze du (scil.: Horusauge) dich auf deinen vollkommenen Altar (???, oder: auf deine vollkommene $ḫꜣ.t$-Perücke?), die deine Amme für dich gefertigt hat!",-1980,-1760,-1870,New Kingdom
Lege dein Würdezeichen auf die Erde nieder für Unas!,-2375,-2345,-2360,Middle Kingdom
(Und) ziehe (?) an der Steuerruderleine!,-1939,-1760,-1850,New Kingdom
"(Glosse B:) Was (die Textstelle) ""er leidet an $st.t$-Schleimstoffen an seinen beiden (Körper)-Seiten"" angeht:
das bedeutet, dass er leidet an den entsprechenden Verlagerungen (?) in seiner Brust,
(wobei sie) in seine beiden (Körper)-Seiten ausgeströmt (?) sind.",-1580,-1539,-1560,Late Period
Das Zählen der Sachen durch den Scheunenschreiber.,-2494,-2345,-2420,Middle Kingdom
"Unas ist der, der ihre Zauberkraft ißt und ihre Ach-Kraft verschlingt.",-2375,-2345,-2360,Middle Kingdom
Der Geschlachtete (11. u.äg. Gau): Ptah läßt das Leben des Teti dauern (Domäne).,-2345,-2323,-2334,Middle Kingdom
"Es kommt doch dieser Unas, $ḫwrr$ der Neunheit, ein unvergänglicher Ach, der dich übertroffen hat, der dich übertrifft, der müder ist als du, der größer ist als du, der gedeihender ist als du, der lauter brüllt als du.",-2375,-2345,-2360,Middle Kingdom
"Ein Opfer, das der König gibt, ein Opfer, das Anubis gibt:",-2345,-2323,-2334,Middle Kingdom
"König von Ober- und Unterägypten, Qaa-nebti",-3150,-2800,-2975,Old Kingdom
"Der Assistent, er beobachtet den Lehrer.",-1939,-1760,-1850,New Kingdom
"Das sind keine Leute, denen man Respekt erweist.",-1837,-1819,-1828,New Kingdom
Teti ist wieder am Himmel erschienen.,-2345,-2323,-2334,Middle Kingdom
"Geöffnet sind dir die beiden $zmzr.w$, die die Rechit abwehren.",-2287,-2278,-2283,Middle Kingdom
(und) jedermann umarmt (jetzt) seinen Gefährten.,-1939,-1760,-1850,New Kingdom
Das Herausgehen der Milchkühe zum Oberland nach dem in den Marschen Sein.,-2345,-2323,-2334,Middle Kingdom
"Verhindern, dass eine Frau schwanger wird.",-1818,-1630,-1724,New Kingdom
Er wird nicht sterben und dieser Unas wird nicht sterben.,-2375,-2345,-2360,Middle Kingdom
Horus hat (es) dir gegeben.,-2278,-2184,-2231,Middle Kingdom
"Der Aufseher der Chentuschi (Pächter) Kai-huief, er sagt:",-2345,-2181,-2263,Middle Kingdom
"Unas ist nicht an der Spitze der Götter, die Unordnung bringen.",-2375,-2345,-2360,Middle Kingdom
"""Der-auf-dem-Roten(?)"" ist es, der sie für ihn fesselt.",-2375,-2345,-2360,Middle Kingdom
"Teti wird auf dem Wulst an dem ""Scheitel"" (der Standarte) zum Himmel emporsteigen.",-2345,-2323,-2334,Middle Kingdom
Totenpriester sind für ihn ernannt worden.,-2414,-2375,-2395,Middle Kingdom
"Osiris Neith, nimm dir das Horusauge und verhindere, daß er es verletzt.",-2278,-2184,-2231,Middle Kingdom
"(Denn/weil) man kann nicht wissen, was im Herzen ist.",-1939,-1760,-1850,New Kingdom
"Sein Sohn Ii, gerechtfertigt, ist es, der seinen Namen belebt.",-1939,-1760,-1850,New Kingdom
"Seine Frau, der Schmuck des Königs, Hemi.",-2345,-2181,-2263,Middle Kingdom
"Herr der Furchtbarkeit auf den Hügeln, groß an Schrecken in Rosetau,",-1759,-1630,-1695,New Kingdom
"Rein ist der Mund des Teti, (da?) die beiden Neunheiten Teti beweihräuchern.",-2345,-2323,-2334,Middle Kingdom
"Ein Totenopfer für ihn am Neujahrstag, Jahresanfang, Fest des Sokar, Thot-Fest und jedem Fest, täglich, dem Priester des Horus Medjedu Cheops, Priester der zwei Goldhorusse, Hausverwalter des Palastes, Hüter des Geheimnisses, der tagtäglich von seinem Herrn Geliebte, Aufseher der Chentuschi des Palastes Ham-kai und seiner Ehefrau, der Verwalterin des Königsvermögens Nebu-anch.",-2345,-2181,-2263,Middle Kingdom
"Die Priesterin der Hathor, Priesterin der Neith (und) Verwalterin des Königsvermögens (auch Rangtitel) Chenti.",-2487,-2455,-2471,Middle Kingdom
"Ein Totenopfer für ihn (am) Neujahrstag, Thot-Fest, Jahresanfangsfest, Wag-Fest und (an) jedem Fest (für) den Vorsteher der sechs Chentuschi des Palastes, Gehilfe (für) die Akten des Sprechers des Königs, Wab-Priester des Königs, Aufseher der Wab-Priester, Chentischi (Pächter ?), Hüter des Geheimnisses und Priester des Cheops Jasen.",-2345,-2181,-2263,Middle Kingdom
Der Sohn seines Sohnes Kai-huief.,-2345,-2181,-2263,Middle Kingdom
"""Es gibt hier nichts (Herstellungs-) Geeignetes außer den (Sack) Gerste von diesen musizierenden Tänzerinnen.",-1580,-1539,-1560,Late Period
Ein Aufwärter des großen Kellers.,-2613,-2494,-2554,Middle Kingdom
"Ein Opfer, das der König und Osiris, der Herr von Busiris, Chontamenti, der Herr von Abydos an allen seinen Plätzen, geben.",-1980,-1939,-1960,New Kingdom
"Sein ältester Sohn, sein Geliebter, der Kammerdiener des Königs und Baumeister des Königs in den zwei Häusern Senedjem-ib.",-2494,-2181,-2338,Middle Kingdom
"Veranlasse, daß ihm dies geöffnet wird.",-2375,-2345,-2360,Middle Kingdom
Keine Flutwelle wird dich mitreißen.,-1939,-1760,-1850,New Kingdom
Versieh dein Gesicht mit ihm.,-2375,-2345,-2360,Middle Kingdom
"Teti ist (weg)gegangen, (ihr) beiden Himmel, Teti ist (wieder)gekommen, (ihr) beiden Länder. (?) / Teti hat die beiden Himmel durchzogen, die beiden Länder kommen zu Teti. (?)",-2345,-2323,-2334,Middle Kingdom
"Möge Re, der im Himmel ist, dir gnädig sein und die Beiden Herren für dich zufriedenstellen.",-2375,-2345,-2360,Middle Kingdom
Chenti-irti ist mit seinem Ka gegangen.,-2375,-2345,-2360,Middle Kingdom
Das Abwehren einer Schlange ist es.,-1845,-1819,-1832,New Kingdom
"Der Vorsteher der Handwerker des Webens, Herr der Ehrwürdigkeit beim großen Gott und ein von seinem Herrn Geliebter, der Verwalter des Königsvermögens In-kaef.",-2345,-2181,-2263,Middle Kingdom
"Die $tḫb$-Schwellung, die auf ihm (d.h. dem Bruch) ist, erhebt sich / nimmt zu,",-1580,-1539,-1560,Late Period
"Nimm (oder: sieh?) das Horusauge, das er zugewiesen hat.",-2278,-2184,-2231,Middle Kingdom
"(Denn) der Nachsichtige/Geduldige pflegt die Freundschaft zu verlängern (?) und einen Fall/Fehler, der passiert ist, zunichte zu machen.",-1939,-1760,-1850,New Kingdom
"""Mögest Du gelobt sein. Ich kenne ihre Anzahl nicht, o Herrscher, LHG, mein Herr.",-1580,-1539,-1560,Late Period
Versieh dein Gesicht mit ihm.,-2321,-2287,-2304,Middle Kingdom
Das Zählen der Sachen der Scheune.,-2494,-2345,-2420,Middle Kingdom
Ein Totenopfer für ihn täglich und ewiglich.,-2494,-2345,-2420,Middle Kingdom
"Denn heute hast Du begonnen, alt zu werden!",-1939,-1760,-1850,New Kingdom
"Siehe, es bedeutet, daß der Traum sich auflöst (oder: vernichtet worden ist) (?).",-1939,-1760,-1850,New Kingdom
"(Dann) wird dein Haus(halt) dauerhaft sein auf seinem (des Vorgesetzten) (Grund)besitz, indem deine Belohnung dementsprechend ist.",-1939,-1760,-1850,New Kingdom
Das Sieben des Mehls seitens der Müllerin.,-2414,-2375,-2395,Middle Kingdom
"Tausend an Brot und Bier, tausend an Alabastergefäßen, tausend an Kleidung.",-2345,-2181,-2263,Middle Kingdom
"Steh an den beiden Türflügeln des Horizontes, öffne die beiden Türflügel des Wassergebietes (des Himmels) und steh vor ihnen wie Geb, der vor der Neunheit ist.",-2278,-2184,-2231,Middle Kingdom
(Es) werde gekocht; (es) werde damit verbunden.,-1939,-1630,-1785,New Kingdom
Die beiden Inseln des Chnum (Domäne).,-2613,-2494,-2554,Middle Kingdom
Geh über ihn (den Fall?; oder: den Mann?) hinweg!,-1939,-1760,-1850,New Kingdom
"Geschenk (für den) Palast, Nefer-iru",-2800,-2650,-2725,Old Kingdom
"""Geh hinunter und hole davon!",-1580,-1539,-1560,Late Period
"(Und) prahle nicht deswegen (, daß du Kinder hast)!",-1939,-1760,-1850,New Kingdom
"Umfange ihn, Große, diesen Größten unter deinen Kindern!",-2278,-2184,-2231,Middle Kingdom
"Er hat die Erde mit dem, was er weiß, an dem Tag geöffnet, an dem er zu kommen wünschte"", sagt Wer-sekat, der in der Unterwelt wohnt.",-2375,-2345,-2360,Middle Kingdom
"Und außerdem gibt er (der Patient) noch Blut aus seinem (einen) Nasenloch (oder: seiner (einen) Nasenhöhle), aus seinem (einen) Ohr, aus seinem Mund wegen jenes $sḏ$-Bruchs (oder: 〈an der Seite von ihm, die〉 jenen $sḏ$-Bruch aufweist).",-1580,-1539,-1560,Late Period
"Der leibliche Königssohn, Höfling, Gottessiegler der Barke (namens) Ba-netjeru, Gottessiegler der Barke des (Gottes) Dua-tawi, Gottessiegler der Barke des (Gottes) Herr des Volkes, Gottessiegler der Barke Ba-netjeru und Vorsteher jeder Arbeit des Königs Mer-ib.",-2613,-2494,-2554,Middle Kingdom
"Sie sind die Künstlerschaft (oder: Experten), die das, was ist, erschaffen (oder: sich entwickeln lassen) und die einen abgeschnittenen Kopf (wieder) anfügen.""",-1939,-1760,-1850,New Kingdom
"Mögest du erscheinen, mögest du erscheinen!",-1759,-1630,-1695,New Kingdom
Seine Uräen sind an seinem Scheitel.,-2375,-2345,-2360,Middle Kingdom
Auch du bist mit deinem Ka gegangen.,-2375,-2345,-2360,Middle Kingdom
"Leopardenfellschurz - tausend, Maset-Fellgewand - tausend, Bett - tausend, Kopfstütze - tausend, Djeser-Möbel - tausend, Holztruhe - tausend, Hen-Kasten - tausend;",-2494,-2345,-2420,Middle Kingdom
(Behandlung:) Dann mußt du folglich jene seine Wunde mit Öl/Fett beträufeln(?).,-1580,-1539,-1560,Late Period
Der Senior-Vorsteher der Schreiber Kai-her-Ptah.,-2345,-2181,-2263,Middle Kingdom
"Kommen war es, was Djedi (selbst) tat, stromabwärts in dem Transportschiff, in dem (auch) der Königssohn Djedefhor war.",-1580,-1539,-1560,Late Period
(Titel:) Erfahrungswissen über eine Wunde an seiner Brust.,-1580,-1539,-1560,Late Period
Nun sagte die Majestät des Horus:,-1939,-1760,-1850,New Kingdom
"Ein Opfer, das der König gibt, ein Opfer, das Anubis, der vor der Gotteshalle ist, gibt:",-2414,-2375,-2395,Middle Kingdom
"Auf jedem Denkmal, das ich angefertigt habe, habe ich meine Taten geschrieben:",-1878,-1837,-1858,New Kingdom
Stürze (dich) nicht auf das Fleisch neben einem Gierigen (oder: in der Gesellschaft eines Gierigen)!,-1939,-1760,-1850,New Kingdom
Der Sem-Priester und einzige Freund (des Königs) Ra-wer.,-2475,-2455,-2465,Middle Kingdom
Sie sollen nicht deine Hand packen zum Haus Jenes Ba hin.,-2321,-2287,-2304,Middle Kingdom
"Mein Anhänger, mein Geliebter und mein Bruder.",-2345,-2181,-2263,Middle Kingdom
(Dann) weg damit (wörtl.: auf dem Boden)!,-1939,-1760,-1850,New Kingdom
Unas ist an der Spitze des Gefolges des Re;,-2375,-2345,-2360,Middle Kingdom
Das (dient der) Vernichtung des Feindes.,-1818,-1630,-1724,New Kingdom
Drei sind am Himmel bei Re.,-2375,-2345,-2360,Middle Kingdom
"Wenn er Wasser trinkt, dann würgt (??) er bei (?) dem, was aus der Öffnung seiner Wunde (ständig) herauskommt.
(oder: Wenn er Wasser trinkt, dann 〈muss〉 er 〈folglich〉 würgen (??) / sich (dagegen) sträuben (??). Es ist aus der Öffnung seiner Wunde, dass (es) herauskommt.)
(oder: Wenn er Wasser trinkt, dann 〈muss〉 er 〈folglich〉 das auswählen (??), was aus der Öffnung seiner Wunde herauskommt.)",-1580,-1539,-1560,Late Period
"Kupferschmied, Verwalter des Königsvermögens, Schiffsbauer Anch-wa",-2686,-2613,-2650,Old Kingdom
"Seine Gemahlin, die Herrin des Hauses, Seruchib.",-1759,-1630,-1695,New Kingdom
"Das Kind des Kinderhortes Kap, Hezui, der Gerechtfertigte.",-1759,-1630,-1695,New Kingdom
"Aufwärter, bringe Wasser dar, entfache das Feuer!",-2375,-2345,-2360,Middle Kingdom
"Daraufhin schwieg sie, ohne zu rudern.",-1580,-1539,-1560,Late Period
"Du hast  das Auge des Re verschluckt, du hast das Auge des Baba verschlungen!",-1980,-1760,-1870,New Kingdom
"Er hat sie dir gebracht, vereinigt.",-2345,-2323,-2334,Middle Kingdom
"""Vernichte das Übel, das an diesem Pepi ist; das Übel, das an ihm ist, höre auf"", sagt Atum.",-2321,-2287,-2304,Middle Kingdom
"Sieh, das Land, man landet auf ihm!",-2487,-2421,-2454,Middle Kingdom
"Er (d.h. der Nahestehende) möge keine Anklage erheben, bis du es gehört haben wirst.",-1939,-1760,-1850,New Kingdom
"(indem/wobei) er (d.h. der Patient) aus seinen Nasenlöchern/Nasenhöhlen und seinen Ohren blutet (wörtl.: er gibt Blut),",-1580,-1539,-1560,Late Period
"Hört der Himmel mit seinem $ꜣḫꜣḫ$-Sternbild auf, hört die Wärme, die in dir ist, auf.",-2278,-2184,-2231,Middle Kingdom
Der Große der Zehn von Oberägypten und Vorsteher der Phylen von Oberägypten Kai-em-ibi.,-2345,-2181,-2263,Middle Kingdom
"Deine Ach-Geister sind dir gegeben worden, die Schakale, die Horus von Hierakonpolis dir gegeben hat.",-2278,-2184,-2231,Middle Kingdom
König von Ober- und Unterägypten Qaa-nebti,-2842,-2800,-2821,Old Kingdom
Opfern von Brot und Bier in der Kapelle des Horus Za,-2800,-2650,-2725,Old Kingdom
"Die Horus schaut, Dienerin des Horus, Arm des Seth Seschemet-kai",-3062,-3018,-3040,Old Kingdom
"(Denn) wichtig (wörtl.: groß) ist das, was den Respekt vor einem Bescheidenen (wörtl.: Schweigenden) bewirken wird.",-1939,-1760,-1850,New Kingdom
"König von Ober- und Unterägypten, Hetep-nebti",-2800,-2780,-2790,Old Kingdom
"Es ist gefährlich, es ist schmerzhaft.",-2278,-2184,-2231,Middle Kingdom
"Deine Mutter wird dir, $Šsꜣ$ (Kundiger?), sagen, daß Neith der ist, der dich beweint hat, daß Neith der ist, der um dich geklagt hat.",-2278,-2184,-2231,Middle Kingdom
"Nut, falle über deinen Sohn Osiris Pepi!",-2321,-2287,-2304,Middle Kingdom
"Tetis Geleiterin (Schlange) ist an seiner Stirn, sie, die die Ba(s) erspäht, die wirkungsvoll ist (?), indem sie versengt(?).",-2345,-2323,-2334,Middle Kingdom
"Die $tḫb$-Schwellung, die auf ihm (d.h. dem Bruch oder eventuell der Wunde) ist, schwillt auf / erhebt sich,",-1580,-1539,-1560,Late Period
(Domäne:) Seschat gibt Asosi Leben.,-2414,-2375,-2395,Middle Kingdom
"Ein Opfer, das der König gibt, ein Opfer, das Osiris gibt:",-2345,-2323,-2334,Middle Kingdom
"Wenn du aber Dinge auf ihren Augen siehst, so wird sie niemals gebären.",-1845,-1773,-1809,New Kingdom
So sollst du dazu sagen:,-1845,-1773,-1809,New Kingdom
Etwas Gutes ersetzt/reicht für das Gute (im Allgemeinen).,-1939,-1760,-1850,New Kingdom
Das Bringen eines Jungtieres des Langhornrindes.,-2494,-2345,-2420,Middle Kingdom
"dem die Rechtfertigung gegeben wird in Anwesenheit des Geb und der versammelten Götterneunheit,",-1759,-1630,-1695,New Kingdom
"Osiris Unas, nimm dir das grüne Horusauge und verhindere, daß er es als Stirnband trägt.",-2375,-2345,-2360,Middle Kingdom
Feuersbrunst(?) ist fern von Pepi Neferkare.,-2278,-2184,-2231,Middle Kingdom
"Der Geduldige ist einer, der vortrefflich an Vorgehensweisen (oder: Maximen) ist.",-1939,-1760,-1850,New Kingdom
"Brot fliegt, ja, Brot fliegt zum Gutsbewohner/-besitzer der Güter der Roten Krone.",-2375,-2345,-2360,Middle Kingdom
"Lebe doch, da das Horusauge dir gebracht worden ist;",-2278,-2184,-2231,Middle Kingdom
"Du sollst nicht zu dem Ort kommen, an dem Unas ist, damit er nicht diesen deinen Namen gegen dich sage ""Wanderer, Sohn einer Wanderin"".",-2375,-2345,-2360,Middle Kingdom
Mögest du zu deinem (wahren) Wesen kommen.,-2321,-2287,-2304,Middle Kingdom
Er wird nicht lebensvoll sein und dieser Unas wird nicht lebensvoll sein.,-2375,-2345,-2360,Middle Kingdom
Weiße Antilope (16. o.äg. Gau),-2800,-2650,-2725,Old Kingdom
"Der Unteraufseher der Chentuschi am Palast, Hüter des Gesiegelten des Palastes, Zugehöriger zu den Akten des Königs, ein von seinem Herrn Geliebter, Imi-set-kai.",-2161,-1980,-2071,New Kingdom
Die Priesterin des Ka (Totenpriesterin) Ni-maat-Hep.,-2494,-2345,-2420,Middle Kingdom
Opfern von Brot und Bier in der Kapelle des Horus Za,-2800,-2650,-2725,Old Kingdom
"In deinem Namen ""Der in Anedjti (Gau von Busiris) ist, Oberhaupt seiner Gaue"".",-2375,-2345,-2360,Middle Kingdom
Das Meißeln (Gestalten) seitens des Bildhauers.,-2345,-2181,-2263,Middle Kingdom
"Ein Opfer, das der König gibt, ein Opfer, das Anubis gibt:",-2345,-2181,-2263,Middle Kingdom
Das Auslegen der Schlinge seitens eines Vorstehers der Fänger.,-2345,-2323,-2334,Middle Kingdom
"Tiat-Gefäß - tausend, Nemet-Gefäß - tausend, Ka-Gefäß - tausend, Alabaster-Gefäß - tausend, Nemeset-Gefäß - tausend, Hewet-Gefäß - tausend, Schamu-Krug - tausend;",-2494,-2345,-2420,Middle Kingdom
"Re wird Pepi Neferkare reinigen und er wird ihn schützen vor dem, was ihm übel angetan werden könnte.",-2278,-2184,-2231,Middle Kingdom
"Der Verwalter des Königsvermögens,  Gutsvorsteher und Totenpriester Kai.",-2494,-2345,-2420,Middle Kingdom
(Und) dann sollst du deine Frau auf angemessene Weise lieben.,-1939,-1760,-1850,New Kingdom
Deine (f.) Mutter ist das Holz.,-1980,-1760,-1870,New Kingdom
"Weihrauch, grüne Schminke, schwarze Augenschminke,  das beste Salböl, Wein (Getränk),  Frucht des Christusdornes.",-2487,-2455,-2471,Middle Kingdom
Der Königsbekannte und Hausvorsteher Ni-meset.,-2686,-2161,-2424,Middle Kingdom
"der sein Gemetzel unter seinen Feinden anrichtet,",-1759,-1630,-1695,New Kingdom
Er wird Neith im Schakal-See reinigen;,-2278,-2184,-2231,Middle Kingdom
Der Verstand (wörtl.: das Herz) hat nachgelassen.,-1939,-1760,-1850,New Kingdom
Mögest du den Opfertisch des Pepi Neferkare gedeihen lassen.,-2278,-2184,-2231,Middle Kingdom
Der Vorsteher der Expedition Ni-anch-nemti.,-2345,-2181,-2263,Middle Kingdom
"O Hety, der befestigt die Festung des ""Daß er den Atem fest macht, der die Nasen erfüllt""!",-1845,-1819,-1832,New Kingdom
Der Wab-Priester des Königs und Priester des Sahure Inpu-hetepu.,-2345,-2181,-2263,Middle Kingdom
"König von Ober- und Unterägypten, Hetep-Nebti",-2800,-2780,-2790,Old Kingdom
Tausende gehen für Teti umher/dienen Teti.,-2345,-2323,-2334,Middle Kingdom
So sollst du dazu sagen:,-1845,-1773,-1809,New Kingdom
Der Verwalter des Königsvermögens und Leiter der Arbeitermannschaft Iuf.,-2345,-2181,-2263,Middle Kingdom
Ein Totenopfer für ihn täglich (und) ewiglich.,-2345,-2181,-2263,Middle Kingdom
Der Vorsteher des Leinenzeugs Per-nedju.,-2494,-2345,-2420,Middle Kingdom
"Diese deine Wasserspenden, o Osiris, diese deine Wasserspenden, o Pepi Neferkare, sind von deinem Sohn gekommen, sind von Horus gekommen.",-2278,-2184,-2231,Middle Kingdom
Er wird nicht lebensvoll sein und dieser Unas wird nicht lebensvoll sein.,-2375,-2345,-2360,Middle Kingdom
"Sein Sohn, der Siegler des Königs von Unterägypten, Gutsverwalter, einziger Freund (des Königs), der Vorlesepriester Djau.",-2345,-2181,-2263,Middle Kingdom
Meine Augen werden durch den Großen (Gott?) geöffnet werden.,-1980,-1760,-1870,New Kingdom
Die leibliche Tochter des Königs Iabtet.,-2494,-2345,-2420,Middle Kingdom
"Daraufhin begab sich Isis vor sie, Nephthys hinter sie, wobei Heket die Geburt beschleunigte.",-1580,-1539,-1560,Late Period
"Er hat mich an die Spitze seiner Edlen erhoben, mit dem Ergebnis, dass ich vor denen gestellt war, die vor mir waren.",-1878,-1837,-1858,New Kingdom
Morgenbrot innerhalb seiner (richtigen) Zeit.,-2278,-2184,-2231,Middle Kingdom
(Behandlung:) Dann musst du sie (d.h. die Wunde) folglich am ersten Tag über (oder: zusammen mit) frischem Fleisch verbinden.,-1580,-1539,-1560,Late Period
Er wird nicht sterben und dieser Unas wird nicht sterben.,-2375,-2345,-2360,Middle Kingdom
"Osiris Neith, ergreife das einzige Horusauge.",-2278,-2184,-2231,Middle Kingdom
Der Vorsteher des Platzes der Chentuschi des Palastes Pehu-en-Ptah.,-2494,-2345,-2420,Middle Kingdom
"Seine Mutter, die Herrin des Hauses, Weben-resch.",-1759,-1630,-1695,New Kingdom
"Dies(er Satz) bedeutet, daß er (d.h. der Text) (ans Ende) kommt.",-1939,-1630,-1785,New Kingdom
Er wird nicht lebensvoll sein und dieser Unas wird nicht lebensvoll sein.,-2375,-2345,-2360,Middle Kingdom
"Thot, plaziere für ihn das Horusauge!",-2321,-2287,-2304,Middle Kingdom
Der einzige Freund (des Königs) Seschem-nefer Tjeti.,-2345,-2181,-2263,Middle Kingdom
Die Gründung des Nefer-anch (Domäne).,-2494,-2345,-2420,Middle Kingdom
(Und) verbeuge dich (wörtl.: krümme deinen Rücken)!,-1939,-1760,-1850,New Kingdom
"Wegen Horus wurdest du geboren, wegen Seth wurdest du empfangen.",-2375,-2345,-2360,Middle Kingdom
Der Aufseher der Totenpriester Hetep-kai.,-2494,-2345,-2420,Middle Kingdom
Der Jüngling und Kadett Hetepu.,-2494,-2345,-2420,Middle Kingdom
"Seine Ehefrau, die Verwalterin des Königsvermögens, Meret-itefes",-2345,-2181,-2263,Middle Kingdom
Möge sie dir dein Herz in deinen Leib bringen.,-2321,-2287,-2304,Middle Kingdom
(Und) beständig ist (ihre) Wirkung.,-1939,-1760,-1850,New Kingdom
Der Vorsteher und Unteraufseher des Haushaltes Schepsi.,-2494,-2181,-2338,Middle Kingdom
"Unas ist der Eine, der Stier des Himmels.",-2375,-2345,-2360,Middle Kingdom
"Die beiden Türflügel des Himmels sind für dich geöffnet worden, die beiden großen Türriegel sind für dich weggeschoben worden, ein Ziegel ist für dich aus dem großen Grab gezogen worden.",-2321,-2287,-2304,Middle Kingdom
"Sei gegrüßt, Min-Amun, Herr der Sehnet-Kapelle.",-1759,-1630,-1695,New Kingdom
Dein Ba ist für dich in dir.,-2321,-2287,-2304,Middle Kingdom
"Siegler des Königs von Unterägypten, Rechnungsbeamter, Meister der Zimmerleute Sen",-2886,-2842,-2864,Old Kingdom
"Osiris Unas, nimm dir das Horusauge und verhindere, daß er an ihm leide.",-2375,-2345,-2360,Middle Kingdom
"Da ging der Oberdomänenvorsteher Rensi, der Sohn des Meru, bis vor seine Majestät, indem/und er sagte:",-1939,-1760,-1850,New Kingdom
Er wird nicht sterben und dieser Unas wird nicht sterben.,-2375,-2345,-2360,Middle Kingdom
"Osiris Unas, nimm dir das Horusauge, mit dem er sich versehen hat.",-2375,-2345,-2360,Middle Kingdom
"Du sollst an der Spitze der Götter sitzen und das tun, was Osiris im Fürstenhaus, das in Heliopolis ist, getan hat, nachdem du deine Würde(zeichen) empfangen hast.",-2321,-2287,-2304,Middle Kingdom
"Nun kam dann dieser Landmann, um zum dritten Mal eine Bitte an ihn zu richten, indem/und er sagte:",-1939,-1760,-1850,New Kingdom
"Sei gegrüßt, Große Flut, Mundschenk der Götter, Leiter der $ḥnmm.t$-Leute!",-2345,-2323,-2334,Middle Kingdom
"Siegler von Unterägypten, Richter an der königlichen Verwaltung",-2686,-2613,-2650,Old Kingdom
"(und) du bist vollendet, (nur) nicht für den Raub.",-1939,-1760,-1850,New Kingdom
"Nachdem wir die Grenze von Wawat erreicht hatten,
sind wir an Bigge vorbeigezogen.",-1939,-1760,-1850,New Kingdom
"Horus ist es, der das, was Seth gegen dich getan hat, wiedergutmachen wird.",-2321,-2287,-2304,Middle Kingdom
"Ein Opfer, das der König gibt: Er möge friedlich auf den schönen Wegen des Westens (Totenreich) wandeln.",-2345,-2161,-2253,Middle Kingdom
Re wird sich auf dich stützen im Horizont.,-2278,-2184,-2231,Middle Kingdom
"Der Vorsteher der Aktenschreiber des Königs, ein von seinem Herrn Geliebter, Seschem-nefer.",-2445,-2421,-2433,Middle Kingdom
Es war eine enge (Landestelle);,-1939,-1630,-1785,New Kingdom
Königlicher Gefolgsmann an jedem Tag,-2686,-2613,-2650,Old Kingdom
Und dann ist die Majestät des Königs von Ober- und Unterägypten 𓍹Snefru𓍺 als ausgezeichneter/wohltuender König über dieses ganze Land eingesetzt worden.,-1939,-1760,-1850,New Kingdom
Die Wasserflut wird dich nicht mitreißen.,-1939,-1630,-1785,New Kingdom
