text,dateNotBefore,dateNotAfter,avgDate,period
"Ein Opfer, das Osiris, der an der Spitze von Busiris ist, gibt:",-2345,-2181,-2263,Middle Kingdom
"Sei gegrüßt, du an Horus' Vorderseite, die Horus auf den Scheitel seines Vaters Osiris gesetzt hat.",-2278,-2184,-2231,Middle Kingdom
"Ich (be)antwortete (es) mit der Antwort eines Furchtsamen: ""Was sagt mir mein Herr?""",-1939,-1760,-1850,New Kingdom
"Dein Sohn Horus hat ihn geschlagen, er hat ihm sein Auge entrissen und er hat es dir gegeben, damit du dadurch ba-haft und mächtig seist an der Spitze der Verklärten.",-2278,-2184,-2231,Middle Kingdom
(Aber) Besitz kann nicht vollendet sein: er (der Besitz?; das Streben nach Vollendung?) wirkt vernachlässigend (oder: gibt Anlaß zu Diskussion/Vorwürfen?).,-1939,-1760,-1850,New Kingdom
"Seine Frau, die Verwalterin des Königsvermögens und Priesterin der Hathor, der Herrin der Wüsten(nekropolen), schön an (Begräbnis)-Platz,  Peseschet.",-2345,-2181,-2263,Middle Kingdom
Verspritze Wasser (= Gift) und die beiden Weihen stehen bereit.,-2375,-2345,-2360,Middle Kingdom
"Tausend an Vrot und Bier, tausend an Alabastergefäßen, tausend an Kleidung, tausend an Salbgefäßen, tausend an Rind, tausend an Geflügel.",-2494,-2345,-2420,Middle Kingdom
"Schützer dessen, was der König täglich sagt",-2686,-2613,-2650,Old Kingdom
Atum hat dir gegeben; die beiden Neunheiten haben für dich gehandelt.,-2278,-2184,-2231,Middle Kingdom
ihre (Wund)ränder (wörtl.: Lippen) sind in gerötetem Zustand;,-1580,-1539,-1560,Late Period
"Ein Opfer, das der König gibt, ein Opfer, das Osiris, der Herr von Busiris, gibt:",-2494,-2181,-2338,Middle Kingdom
"Nut, du bist wirkungsmächtig und mächtig geworden im Leib deiner Mutter Tefnut, bevor du geboren wurdest.",-2321,-2287,-2304,Middle Kingdom
"Geh weg (Hör auf), du sollst nicht jammern, handle gemäß diesem.",-2414,-2375,-2395,Middle Kingdom
"Ein Totenopfer für die Versorgte durch Anubis, der Verwalterin des Königsvermögens und Priesterin der Hathor Hetep-Wadjet.",-2345,-2181,-2263,Middle Kingdom
"Pepi wird wirkungsmächtiger sein als die Wirkungsmächtigen, trefflicher als die Trefflichen; Pepi dauert mehr als die Dauernden.",-2321,-2287,-2304,Middle Kingdom
Dann musst du ihn/es (den Patienten oder das eine Schlüsselbein) folglich mit $bḏꜣ$-Polster/Röllchen/Ballen(?) aus Leinenstoff verbinden.,-1580,-1539,-1560,Late Period
(Und) ich schlief auf einem Bett.,-1939,-1760,-1850,New Kingdom
"Pepi Neferkare ist aus Pe gekommen, indem die Flamme rot ist und Chepri lebt.",-2278,-2184,-2231,Middle Kingdom
"dieser Gott, der Älteste/Fürst der Götter, der König von Ober- und Unterägypten, 𓍹Osiris𓍺, der Gerechtfertigte.",-1707,-1688,-1698,New Kingdom
"Mögest du für Pepi Neferkare die Menschen und Götter  zufriedenstellen/günstig stimmen, damit sie ihm jedes Mahl geben.",-2278,-2184,-2231,Middle Kingdom
"Daraufhin sagte er, was er als Zauber(sprüche) zu sagen pflegte.",-1580,-1539,-1560,Late Period
Unas durchzieht Schu und er durchschreitet Aker.,-2375,-2345,-2360,Middle Kingdom
"zu dem das, was ist und nicht ist, kommt,",-1939,-1760,-1850,New Kingdom
"""O Oberdomänenvorsteher, mein Herr, die Zunge der Menschen, das ist ihre Standwaage (wörtl.: ihre Zunge ist die Standwaage der Menschen).",-1939,-1760,-1850,New Kingdom
Die $nꜥw$-Schlange ist von der $nꜥ.t$-Schlange gebissen worden und die $nꜥ.t$-Schlange ist von der $nꜥw$-Schlange gebissen worden.,-2375,-2345,-2360,Middle Kingdom
"Der Vorsteher der Stadt, Wesir, Vorsteher der sechs Gerichtshöfe, Iimeru-Neferkare.",-1689,-1688,-1689,New Kingdom
"Das ist es, was es (= die Bitte) besagt.",-1617,-1610,-1614,Late Period
"Falle, Gewaltätiger, dessen Rage besänftigt ist.",-1945,-1875,-1910,New Kingdom
Dein Ka wird mich das Ende meines Leibes in der Residenz (zu Hause) verbringen lassen!,-1939,-1760,-1850,New Kingdom
"Herr der Ewigkeit, Herrscher der Götter,",-1939,-1760,-1850,New Kingdom
Der Vorsteher der zwei Speiseverwaltungen Seschemnefer.,-2487,-2421,-2454,Middle Kingdom
"Ihr Ba ist ja bei Unas, ihre Schatten sind von ihren Besitzern (entfernt).",-2375,-2345,-2360,Middle Kingdom
"der die Produkte aller Fremdländer zu seinem Herrn bringt, der Vorsteher aller Fremdländer des südlichen Oberägypten,",-2278,-2184,-2231,Middle Kingdom
"Ein Opfer, das der König gibt, ein Opfer, das Anubis, der auf seinem Berge ist, der Imiut und Herr der Nekropole gibt:",-2345,-2181,-2263,Middle Kingdom
"Der Versorgte bei Ptah, Sabni.",-2278,-2184,-2231,Middle Kingdom
Dann musst du folglich seinen Verband lösen.,-1580,-1539,-1560,Late Period
Das Herbeibringen des ausgelösten Fleischstücks.,-2414,-2375,-2395,Middle Kingdom
"Statte dich mit dem Horusauge aus, der Roten Krone mit großer Macht und vielen Wesen(?), damit sie dich, Neith, schütze, wie sie Horus schützt.",-2278,-2184,-2231,Middle Kingdom
"Nehmt doch Teti mit euch mit, damit Teti von dem esse, wovon ihr eßt, damit Teti von dem trinke, wovon ihr trinkt, damit Teti von dem lebe, wovon ihr lebt, damit Teti dort sitze, wo ihr sitzt, damit Teti stark sei in dem, worin ihr stark seid, damit Teti damit fahre, womit ihr fahrt.",-2345,-2323,-2334,Middle Kingdom
Das Bringen des Langhornrinds als Gabe für das Totenopfer.,-2494,-2345,-2420,Middle Kingdom
"Respektiere deine Assistenten (?), (damit) dein Besitz existieren wird.",-1939,-1760,-1850,New Kingdom
"Atum wird dich nicht dem Horus geben, dieser wird nicht dein Herz prüfen, dieser wird nicht über dein Herz Macht haben.",-2375,-2345,-2360,Middle Kingdom
"Der (gute) Charakter ist ein Denkmal,",-1939,-1760,-1850,New Kingdom
"Der Gott, dessen Kopf blind ist, wird beschworen werden; du selbst wirst hier beschworen werden, Skorpion.",-2375,-2345,-2360,Middle Kingdom
"Deine Hände seien um das Mahl, deine Tochter; versieh dich damit.",-2375,-2345,-2360,Middle Kingdom
Horus wird Neith an seine beiden Finger (d.h. an seine Seite?) nehmen.,-2278,-2184,-2231,Middle Kingdom
(Behandlung 1:) Dann musst du sie/ihn (d.h. die Wunde oder den Patienten) folglich am ersten Tag über (oder: zusammen mit) frischem Fleisch verbinden.,-1580,-1539,-1560,Late Period
"Möge er sich auf jener Seite aufstellen, wie (es) der Lobpreisende (?) tun wird.",-1939,-1760,-1850,New Kingdom
"Sei nicht gewichtig, (indem/weil) du (noch) nicht leicht gewesen bist!",-1939,-1760,-1850,New Kingdom
"Die Totenpriesterin, seine Schwester Ni-su-Ptah.",-2345,-2181,-2263,Middle Kingdom
"Ein Opfer, das der König gibt, ein Opfer, das Anubis, der vor der Gotteshalle ist, gibt:",-2345,-2181,-2263,Middle Kingdom
"der (weiter) vorn ist als jeder (andere) Gott (oder: Anführer/Beispiel, mehr als jeder andere Gott):",-1759,-1630,-1695,New Kingdom
Der Kopf der großen schwarzen $kꜣ$-Schlange ist abgeschnitten worden.,-2375,-2345,-2360,Middle Kingdom
"Oberägyptisches Mundöffnungsgerät, (aus) Metall, unterägyptisches Mundöffnungsgerät, (aus) Metall.",-2375,-2345,-2360,Middle Kingdom
Denn ich bin doch ein Brennender unter den Schrecklichen!,-2161,-1760,-1961,New Kingdom
Dein schönes Brot ist in Pe bereitet worden.,-2375,-2345,-2360,Middle Kingdom
"""(Nur) einer, der gerufen wird, ist auch einer, der kommt, O Herrscher, LHG.",-1580,-1539,-1560,Late Period
"– Von einem, den etwas geschlagen hat, das von außen eingetreten ist (d.h. etwas dämonisches, eine dämonische Einwirkung), sollst du ihn unterscheiden,
d.h. als einen (oder: und auch von einem), bei dem der (Gelenk?-)Kopf des $ꜣmꜥ.t$-Knochens in seiner $qꜥḥ$-Schulter sich nicht gelöst hat,
und (als) einen (oder: und von einem), dessen $ꜥn.t$-Finger (Daumen?) nicht in die Mitte seiner Hand gefallen ist. –",-1580,-1539,-1560,Late Period
"Möge er dir das geben, was an Horus' Stirn ist, damit du dadurch ba-mächtig bist, damit du dadurch Macht hast, damit du dadurch an der Spitze der Westlichen bist.",-2375,-2345,-2360,Middle Kingdom
"Sein ältester Sohn, sein Geliebter, der Kammerdiener des Königs und Baumeister des Königs in den zwei Häusern Senedjem-ib.",-2494,-2181,-2338,Middle Kingdom
Daraufhin wurden Schiffe für den Königssohn Djedefhor ausgerüstet.,-1580,-1539,-1560,Late Period
"Dieser Pepi Neferkare ist zum Himmel emporgestiegen und hat Re bereit/wartend, daß er sich ihm nähere, angetroffen.",-2278,-2184,-2231,Middle Kingdom
"Domäne ""Horus, Erster der Körperschaft""",-2974,-2930,-2952,Old Kingdom
"Ein Opfer, das der König gibt, ein Opfer, das Anubis gibt:",-2345,-2181,-2263,Middle Kingdom
"(Glosse A:) Was (die Textstelle) ""sein (Hirn-)Schädel ist zersplittert/zertrümmert"" angeht:
das bedeutet, daß sein (Hirn-)Schädel zersplittert/zertrümmert wurde;",-1580,-1539,-1560,Late Period
Ein das Gelobte machende Leiter des Speisezeltes.,-2345,-2181,-2263,Middle Kingdom
"Osiris Pepi Neferkare, nimm dir das Horusauge.",-2278,-2184,-2231,Middle Kingdom
"(Denn) siehe, ich bin in einer Verlustlage (oder: einer, der einen Verlust hat).""",-1939,-1760,-1850,New Kingdom
Der Leiter des Speisezeltes Pen-meru.,-2345,-2181,-2263,Middle Kingdom
"Er möge bestattet sein in der westlichen Begräbnisstätte, indem er sehr schön alt ist, als Herr der Ehrwürdigkeit (und) Herr der Ehrwürdigkeit beim großen Gott, der Verwalter des Königsvermögens Nefer-nisut.",-2487,-2455,-2471,Middle Kingdom
"Er möge friedlich auf den schönen Wegen gehen, auf denen die Versorgten gehen vor dem Großen Gott.",-2345,-2181,-2263,Middle Kingdom
Der Vorsteher des Leinenzeugs Imi.,-2494,-2181,-2338,Middle Kingdom
"(Denn) man kann nicht wissen, was im Herzen ist.",-1939,-1760,-1850,New Kingdom
"Ein Opfer, das der König gibt, ein Opfer, das Anubis,  der Herr der Nekropole, gibt:",-2494,-2181,-2338,Middle Kingdom
Das Henefu-Gebäck des Seschem-nefer (Domäne).,-2494,-2345,-2420,Middle Kingdom
"Der Verwalter des südlichen Wüstenrandes, Verwalter des Königsvermögens Nefer-nisut.",-2487,-2455,-2471,Middle Kingdom
Osiris ist mit seinem Ka gegangen.,-2278,-2184,-2231,Middle Kingdom
"Osiris, ergreife dir alle, die Unas hassen und die über seinen Namen schlecht reden!",-2375,-2345,-2360,Middle Kingdom
"Weise nicht den zurück, der dich anfleht (oder: in Anspruch nimmt)!",-1939,-1760,-1850,New Kingdom
"Möget ihr den Himmel durchziehen, vereint im Dunklen.",-2375,-2345,-2360,Middle Kingdom
"Es kommt dieser Unas, ein unvergänglicher Ach, wie der zu Preisende, der über der Nilflut ist.",-2375,-2345,-2360,Middle Kingdom
"groß an Beliebtheit während des Erdendaseins,",-1759,-1630,-1695,New Kingdom
Da war sein Herz froh über alle Maßen.,-1580,-1539,-1560,Late Period
Sein ältester Sohn Anch-em-a-Re hat für ihn (es) gemacht.,-2494,-2181,-2338,Middle Kingdom
"Geht der Große, schützt er seinen Sohn.",-2278,-2184,-2231,Middle Kingdom
Das Totenopfer des Djedef-Chufu - für ihn zu jedem Fest zu machen.,-2613,-2494,-2554,Middle Kingdom
Die Amme des Teti ist (die Milchgöttin) Jat.,-2345,-2323,-2334,Middle Kingdom
"""Wahrscheinlich ist es sein Landmann, der zu einem anderen (etwa: einem anderen Schutzherrn, Patron) in seiner Nähe geht (oder: gegangen ist).",-1939,-1760,-1850,New Kingdom
"Osiris Neith, mögest du leben, mögest du leben.",-2278,-2184,-2231,Middle Kingdom
"Siehe, Gott (selbst) hat dich leben lassen, dadurch daß er dich zu dieser Insel des Ka brachte.",-1939,-1760,-1850,New Kingdom
"Osiris Neith, nimm für dich deinen Kopf in Empfang.",-2278,-2184,-2231,Middle Kingdom
"Pepi Neferkare wird nicht dürsten durch(?) Schu, Pepi Neferkare wird nicht hungern durch(?) Tefnut.",-2278,-2184,-2231,Middle Kingdom
"""Meine Kas/Lebensgeister sind in Jubel, (ihr) Hirten, (ihr) Männer!",-1939,-1760,-1850,New Kingdom
"Tausend an Brot, tausend an Gebäck, tausend an Bier, tausend an Geflügel, tausend an Geflügel, tausend an Geflügel, tausend an Geflügel, tausend an Geflügel, tausend an Opfern.",-2345,-2323,-2334,Middle Kingdom
Die Verwalterin des Königsvermögens Senet-ities.,-2345,-2181,-2263,Middle Kingdom
"Osiris Neith, nimm dir das Horusauge und verhindere, daß er (Seth) es ausreißt.",-2278,-2184,-2231,Middle Kingdom
"Hüte dich, daß er (der Gerichtete?) seine Lage (oder: seine Meinung) erklärt:",-1939,-1760,-1850,New Kingdom
Ein Totenopfer für ihn zu jedem Fest zu jeder Zeit des Jahres.,-2345,-2181,-2263,Middle Kingdom
"Osiris Unas, nimm dir das Horusauge, mit dem er zufrieden war.",-2375,-2345,-2360,Middle Kingdom
Das ist dein leiblicher Sohn in Ewigkeit.,-2375,-2345,-2360,Middle Kingdom
"Der Buntgefiederte, der große Gott, Herr des Himmels.",-1649,-1582,-1616,Late Period
"Rein ist der Mund des Pepi Neferkare, (da?) die  Neunheit Pepi Neferkare beweihräuchert.",-2278,-2184,-2231,Middle Kingdom
Steige du doch empor zu deiner Mutter Nut.,-2321,-2287,-2304,Middle Kingdom
"Möge er das Fleisch des Ka der Neith und ihr eigenes abwischen mit dem, was auf den Schultern des Re ist im Horizont, was er empfängt, wenn die Beiden Länder leuchten und er den Blick der Götter öffnet.",-2278,-2184,-2231,Middle Kingdom
Der Senior-Schreiber und Aufseher der Totenpriester Sehetepu.,-2494,-2181,-2338,Middle Kingdom
"Ein großer Herr ist damit beschäftigt, zu nehmen von dem, was keinen Herrn/Besitzer hat, und (er ist damit beschäftigt,) den Alleinstehenden zu berauben (?).",-1939,-1760,-1850,New Kingdom
"Er möge bestattet sein in der schönen westlichen Wüste, indem er sehr schön alt ist.",-2494,-2345,-2420,Middle Kingdom
Der Aufseher der Priester Kai-em-anch.,-2414,-2375,-2395,Middle Kingdom
"Siehe, du bist mächtig und stark; dein Arm ist aktiv/gewalttätig; dein Herz ist habgierig; die Milde ist an dir vorbeigegangen.",-1939,-1760,-1850,New Kingdom
Er wird nicht sterben und dieser Unas wird nicht sterben.,-2375,-2345,-2360,Middle Kingdom
Du wirst zu deinen Monaten geboren werden wie der Mond.,-2278,-2184,-2231,Middle Kingdom
"Der angreift, wenn er angegriffen wird.",-1837,-1819,-1828,New Kingdom
"Großer des Atum, Sohn eines Großen des Atum, Neith ist der $sḥd$-Stern am Himmel unter den Göttern.",-2278,-2184,-2231,Middle Kingdom
(Aber) jenes da (der Reichtum?; das sich Sorgen?; das Gehen?) ist unwichtig (wörtl.: für die Erde).,-1939,-1760,-1850,New Kingdom
Ein Jungtier der Säbelantilope für das Grab.,-2345,-2323,-2334,Middle Kingdom
"Da gab sie mir eine Ladung, bestehend aus Myrrhe und Salböl, Räucherwerk und Balsam, Tischepes-Holz, Schasech-Parfüm/Pflanzen und Augenschminke, Schwänzen von Giraffen, großen Kuchen von Weihrauch, Stoßzähnen von Elefanten, Windhunden, Lang- und Kurzschwanz-Affen, allen Arten von/an Reichtümern.",-1939,-1760,-1850,New Kingdom
"Deine Augen sind die beiden Kindchen des Atum, (du) Nicht-Untergehender.",-2375,-2345,-2360,Middle Kingdom
"Sei gegrüßt, Upuaut, der den Himmel von der Erde trennt,",-1759,-1630,-1695,New Kingdom
"Seht, derjenige, der den Menschen Anweisungen erteilt, ist im Inneren von Chemmis!",-1759,-1630,-1695,New Kingdom
"Siehe, du bist groß und rund als Großes Rund.",-2321,-2287,-2304,Middle Kingdom
"Nun ernannte er (Amenemhet I.) ihn (Chnumhotep I.) zum Erbfürsten und Grafen, Freundlich-von-Arm, Nomarchen des Oryx-Gaus (= 16. Gau), und er installierte die südlichen Stelen an seiner (oder: als seine) Grenze zum Hasengau/Hermopolites (= 15. Gau), seine nördlichen (Stelen) zum Kynopolites (= 17. Gau), und er verteilte den großen Fluss in der Mitte (wörtl.: auf seinem Rücken):",-1878,-1837,-1858,New Kingdom
Der Chentischi (Pächter ?) Ni-su-qed.,-2345,-2181,-2263,Middle Kingdom
Für den Aufseher der Schreiber des Schatzhauses Ii-mery.,-2345,-2181,-2263,Middle Kingdom
"Wer ist der, der ihn fressen will, der mich fressen will?",-1845,-1819,-1832,New Kingdom
"Lebt er, lebt dieser Unas.",-2375,-2345,-2360,Middle Kingdom
"Ach, (daß) sie mir (doch) mitteilen möge, (daß) es ihren Kindern gut geht!",-1939,-1760,-1850,New Kingdom
"Osiris Neith, nimm dir Horus' weiße Zähne, die deinen Mund ausstatten sollen.",-2278,-2184,-2231,Middle Kingdom
"(Es) werde veranlasst, dass sie es sofort wieder ausspuckt.",-1845,-1773,-1809,New Kingdom
"Ein Opfer, das der König und Min-Horus, der Starke, geben.",-1759,-1630,-1695,New Kingdom
"Würdenträger und Mund von Hierakonpolis, Seneb, gerechtfertigt, Herr der Ehrwürdigkeit.",-1759,-1630,-1695,New Kingdom
Es kommt der blauäugige Horus zu euch.,-2375,-2345,-2360,Middle Kingdom
"Unas wird die Kräuter auf den beiden Ufern des Horizonts grünen lassen, damit Unas dem Großen Auge, das inmitten des Feldes ist, Grün-Glänzendes bringe.",-2375,-2345,-2360,Middle Kingdom
"Es bedeutet, daß sie (d.h. der Traum?) bestraft/vernichtet (oder: sich auflöst).",-1939,-1760,-1850,New Kingdom
"Du sollst auf einem ehernen Thron sitzen, dein Vorderteil (das) ein(es) Schakal(s), dein Hinterteil (das) ein(es) Falke(n), und dir Keule von der Schlachtbank des Osiris und zwei Rippenstücke von der Schlachtbank des Seth (zu Munde) führen.",-2278,-2184,-2231,Middle Kingdom
"(indem) er nicht in der Lage ist, auf seine Schultern und seine Brust zu blicken:",-1580,-1539,-1560,Late Period
Mögest du zusammen mit deinem Vater Atum Gestalt annehmen.,-2375,-2345,-2360,Middle Kingdom
"Siehe, du bist der, der dort (vor Gericht) gerade stehen muss gegen den Gottesdiener Sobeknacht, der Bevollmächtigter des Bürgermeisters von Elkab ist.",-1617,-1610,-1614,Late Period
Ich war entsetzt (mein Herz/Verstand verwirrte sich) und meine Arme gehorchten mir nicht mehr (waren ausgebreitet).,-1939,-1760,-1850,New Kingdom
"Sein Bruder, sein Geliebter, der Totenpriester Heru-nefer",-2345,-2181,-2263,Middle Kingdom
"Er hat dich geschützt als den, der zu seiner Zeit zu schützen ist.",-2321,-2287,-2304,Middle Kingdom
"Die Täler waren Bäche (?) (von Blut), 
die Berge waren Sümpfe, 
die Feinde bildeten Terrassen (?), 
als sie gegeben waren auf das Feuerbecken.",-1920,-1875,-1898,New Kingdom
Dein Schwarzes (d.h. dein Irisbereich) ist in deiner Mitte;,-1980,-1760,-1870,New Kingdom
"Sei gegrüßt, Ba, der in seiner Röte ist, Einziger, den sein Vater nannte, Verständiger, den die Götter nannten, der seinen Sitz einnimmt am Scheitel(punkt) des Himmels, dort, wo dein Herz zufrieden war.",-2278,-2184,-2231,Middle Kingdom
"Worte sprechen zu 'Erde', zu Geb, zu Osiris, zu Anubis, zu Wer-hab.",-2287,-2278,-2283,Middle Kingdom
"In deinem Herzen ist alles, was ich tun werde.",-1694,-1693,-1694,New Kingdom
Möge Tait in Frieden erwachen!,-2375,-2345,-2360,Middle Kingdom
"Sein geliebter Sohn, der Wab-Priester des Königs und der Sachmet, der Priester des Cheops, der Chentischi (Pächter ?) Kai-her-setef.",-2613,-2494,-2554,Middle Kingdom
Der Vorsteher der Chentuschi am Palast Hetep-eni-Ptah.,-2345,-2181,-2263,Middle Kingdom
"Die Königsbekannte, Tepes ist der Kosename, Nefer-hetep-Hathor ist der Hauptname.",-2686,-2613,-2650,Old Kingdom
Unas hat sich mit dem Horusauge gereinigt.,-2375,-2345,-2360,Middle Kingdom
"Ein Opfer, das der König gibt, ein Opfer, das Anubis gibt:",-2414,-2375,-2395,Middle Kingdom
"Jener ist für dich geboren worden, dieser ist für dich empfangen worden.",-2375,-2345,-2360,Middle Kingdom
"Wie der Name des Chenti-irti in Letopolis fortdauert, so wird der Name des Nemti-em-za-ef Merenre dauern und wird diese Pyramide ebenso dauern, ewiglich.",-2287,-2278,-2283,Middle Kingdom
"(Titel:) Erfahrungswissen über eine klaffende Wunde in seinem Kopf, 〈die bis zum Knochen reicht〉
– sein (Hirn-)Schädel ist zerbrochen/zertrümmert.",-1580,-1539,-1560,Late Period
"Unas ist der Stier des (doppelten ?) Lichtglanzes, der inmitten seines Auges ist.",-2375,-2345,-2360,Middle Kingdom
Tausend an Ser-Gänse für Kai-em-anch.,-2414,-2375,-2395,Middle Kingdom
Unas ist der Große Gott.,-2375,-2345,-2360,Middle Kingdom
"Osiris Unas, nimm dir das Horusauge.",-2375,-2345,-2360,Middle Kingdom
Der Wab-Priester des Königs und Gutsvorsteher Nefer.,-2494,-2181,-2338,Middle Kingdom
Horus hat ihn für dich zurückgetrieben.,-2321,-2287,-2304,Middle Kingdom
"(Untersuchung:) Wenn du einen Mann (d.h. Patienten) mit einem $ḥsb$-Bruch in der $šty.t$-Kammer seiner Nase untersuchst, dann findest du seine Nase krumm stehend vor;",-1580,-1539,-1560,Late Period
"Er möge zum Großen Gott, dem Herrn des Westens und Herr aller reinen Plätze, aufsteigen gelassen werden unter den geliebt werdenen Ehrwürdigen des Großen Gottes, Herr der Ehrwürde und Herr des schönen Begräbnisses in der Nekropole.",-2345,-2323,-2334,Middle Kingdom
"Ist er lebensvoll, ist dieser Unas lebensvoll.",-2375,-2345,-2360,Middle Kingdom
"(Glosse A:) Was (die Textstelle) ""die $nrw.t$-Zerrung/Verstauchung/Zerreißung"" angeht:
Er (d.h. der Arzt oder ein zuvor genanntes Handbuch) sagt (dies) über das $ngi̯.t$-Aufgerissensein/Auseinanderreißen durch das Gelenk(?) (oder: seitens zweier Glieder/Gelenkteile),
wobei es (d.h. das Gelenk oder jedes Glied) (allerdings noch) an seiner Stelle ist.",-1580,-1539,-1560,Late Period
Du hast die Knochen einer verwesenden Katze gekaut!,-1845,-1819,-1832,New Kingdom
"Horus ist gekommen, damit er dich (auf Vollständigkeit) prüfe(?) (lit.: zähle)/erkenne.",-2345,-2323,-2334,Middle Kingdom
"Die Herrin des Hauses, Nehi, gerechtfertigt.",-1759,-1630,-1695,New Kingdom
"Süßer Duft des Mahls, du gehörst zur Nase.",-2278,-2184,-2231,Middle Kingdom
"Ein Opfer, das der König gibt ein Opfer, ein Opfer, das Anubis, der vor der Gotteshalle ist, gibt:",-2494,-2345,-2420,Middle Kingdom
"Sei nicht überheblich gegenüber dem, der keine Kinder hat!",-1939,-1760,-1850,New Kingdom
Osiris ist mit seinem Ka gegangen.,-2375,-2345,-2360,Middle Kingdom
Möge die Jublerin dir zujubeln wie Anubis an der Spitze der Gotteshalle.,-2278,-2184,-2231,Middle Kingdom
"Ein Opfer, das der König gibt, ein Opfer, das Anubis gibt:",-2445,-2421,-2433,Middle Kingdom
"(Untersuchung:) Wenn du einen Mann (d.h. Patienten) mit einer (offenen) Wunde in seiner (einen) Nasenhöhle untersuchst, wobei sie (d.h. die Wunde) aufgeweicht/eingetieft/eingesunken(?) ist,
dann findest du die beiden Ränder jener Wunde auseinandergezogen(?) in Bezug auf einander vor.",-1580,-1539,-1560,Late Period
Das Betrachten der Feldbestellung (durch) den Verwalter des Königsvermögens Jasen.,-2345,-2181,-2263,Middle Kingdom
"Tapferkeit bedeutet Angriff, 
Feigheit bedeutet Rückzug.",-1837,-1819,-1828,New Kingdom
Bist du (überhaupt) am Leben?,-1939,-1760,-1850,New Kingdom
"Geb hat veranlaßt, daß Horus sie dir gibt, damit du mit ihnen zufrieden seist.",-2345,-2323,-2334,Middle Kingdom
Du sollst dich ihm in diesem deinem Namen 'Re' nähern.,-2375,-2345,-2360,Middle Kingdom
"Ein Opfer, das der König (und) Osiris, der Vorderste der Westlichen, der Herr von Abydos gibt.",-1939,-1760,-1850,New Kingdom
"Mache ihn (daher/also) nicht zu einem, der dir nahe sein wird!",-1939,-1760,-1850,New Kingdom
"Teti ist ein Herr von Boten, der Aufträge erteilt.",-2345,-2323,-2334,Middle Kingdom
"der Herr der Kraft, der aus Chemmis herauskommt,",-1759,-1630,-1695,New Kingdom
"Schatzhaus von Unterägypten, Weingarten des Königs",-2930,-2886,-2908,Old Kingdom
"Osiris Neith, nimm dir das Horusauge, das zauberreiche.",-2278,-2184,-2231,Middle Kingdom
Es geht Teti gut/Teti ist gesättigt/Teti erholt sich:,-2345,-2323,-2334,Middle Kingdom
"Ein Opfer, das der König gibt, ein Opfer, das Anubis gibt:",-2345,-2323,-2334,Middle Kingdom
Erweichen der $šw.t$ der $mt.w$-Gefäße.,-1939,-1630,-1785,New Kingdom
Es wurde angefertigt als Urkunde für das Wesirsbüro an diesem Tage.,-1617,-1610,-1614,Late Period
Du mögest auf das Lenktau achten!,-2414,-2375,-2395,Middle Kingdom
Mein Herz ist müde geworden.,-1939,-1760,-1850,New Kingdom
"Der 'Wanderer', der die Herren niedermetzelt, ist es, der sie für Teti absticht und er holt das, was in ihrem Leib ist, für ihn heraus.",-2345,-2323,-2334,Middle Kingdom
Der Verwalter des Königsvermögens (und) Aufseher der Schatzhausverwalter Kai-em-anch.,-2414,-2375,-2395,Middle Kingdom
Der Hund ist zugrunde gegangen (?).,-1759,-1630,-1695,New Kingdom
"Diese deine Wasserspenden, o Osiris, diese deine Wasserspenden, o Unas, sind von deinem Sohn gekommen, sind von Horus gekommen.",-2375,-2345,-2360,Middle Kingdom
"Mögest du leben, erneuert und verjüngt sein wie Re ewiglich.",-1759,-1630,-1695,New Kingdom
"Tut er (es), so ist es schwierig zu sehen/beobachten, dass (es) durch ihn geschieht.
oder: Tut er (es), so ist es schwierig, das mit ihm Passierte (oder: durch ihn Verwirklichte) zu beobachten.
oder: Tut er (es), so ist das (Hinab)blicken, das durch ihn geschieht, schwierig/schmerzlich.",-1580,-1539,-1560,Late Period
"mit kundigem Gesicht beim Ausüben seines Amtes, der zuerst eintritt und zuletzt herausgeht;",-1580,-1539,-1560,Late Period
"Der Bekannte des Königs und Vorsteher der Sänger, Wer-neb-kem, er sagt:",-1759,-1630,-1695,New Kingdom
Der Geruch seiner Ausdünstung ist wie (der Geruch) einer Spitzmaus.,-1939,-1760,-1850,New Kingdom
"Osiris Neith, nimm dir den Vorderschenkel des Seth, den Horus ausgerissen hat.",-2278,-2184,-2231,Middle Kingdom
"Ein Totenopfer für ihn am Neujahrstag (Fest), Thot-Fest, Jahresanfang (ein Fest), Wag-Fest (Totenfest) und jedem Fest, täglich.",-2345,-2181,-2263,Middle Kingdom
"Siebe dieses Getreide, das er hingelegt hat, ordentlich.",-2345,-2181,-2263,Middle Kingdom
"Wenn er (der Große) überlegt, um ihn (den Boten) deswegen zu bestrafen, (so) verstummt er (der Bote) mit (den Worten): ""Ich habe gesprochen"".",-1939,-1760,-1850,New Kingdom
Der Aufseher der Schreiber des Königsleinens Ii-mery.,-2345,-2181,-2263,Middle Kingdom
Teti umrundet den Himmel wie Re.,-2345,-2323,-2334,Middle Kingdom
"Die Lebenszeit des Teti ist die Ewigkeit, die Grenze des Teti ist die Unendlichkeit in dieser seiner Würde eines 'Will-er-so-tut-er, will-er-nicht-so-tut-er-nicht', der auf immer und ewig im Bereich des Horizontes ist.",-2345,-2323,-2334,Middle Kingdom
"Nimm dir den Ausfluß, der aus dir hervorgekommen ist; dein Herz wird dadurch nicht müde sein.",-2278,-2184,-2231,Middle Kingdom
