text,dateNotBefore,dateNotAfter,avgDate,period
"Dein Sohn Horus hat es für dich gelöst, damit du dadurch lebst.",-2375,-2345,-2360,Middle Kingdom
So sollst du dazu sagen:,-1845,-1773,-1809,New Kingdom
Der Aufseher der Palastsänger Nefer-renpet.,-2494,-2345,-2420,Middle Kingdom
"Deine Hände seien um das Mahl, deine Tochter; versieh dich damit.",-2375,-2345,-2360,Middle Kingdom
(und wobei) er an Steifheit/Steifigkeit im Nacken leidet:,-1580,-1539,-1560,Late Period
Du sollst dein Herz nicht von ihm abwenden (wörtl.: trennen)!,-1939,-1760,-1850,New Kingdom
"Daraufhin wurde gehandelt entsprechend allem, was seine Majestät befohlen hatte.",-1580,-1539,-1560,Late Period
"Er traf (wörtl.: fand) ihn, (als) er (gerade) aus der Tür seines Hauses herauskam, um zu seinem Dienstschiff hinunterzugehen.",-1939,-1760,-1850,New Kingdom
Werde dem (betroffenen) Mann auf seine Hand gegeben.,-1939,-1630,-1785,New Kingdom
"Osiris Neith, öffne deinen Mund mit dem, was füllt/gefüllt ist mit(?) dir.",-2278,-2184,-2231,Middle Kingdom
Setz dich und schweige; Königstotenopfer.,-2375,-2345,-2360,Middle Kingdom
"Siehe, er wird (das Korn auf der Tenne) dreschen (wörtl.: austreten) (müssen) wegen seines Vergehens.",-1939,-1760,-1850,New Kingdom
Es war eine enge (Landestelle);,-1939,-1760,-1850,New Kingdom
"für den seine Schwester Isis gehandelt hat,",-1759,-1630,-1695,New Kingdom
"Osiris Nemti-em-za-ef Merenre, du bist der Ka aller Götter.",-2287,-2278,-2283,Middle Kingdom
Das mit der Gründung Verbundene (?) (Domäne).,-2487,-2455,-2471,Middle Kingdom
"Nimm dir den Ausfluß, der aus dir hervorgekommen ist.",-2278,-2184,-2231,Middle Kingdom
"Er ist es, der Atum hochheben wird.",-2375,-2345,-2360,Middle Kingdom
"Seine Ehefrau, die Hofdame, Iuhet-ib.",-1572,-1569,-1571,Late Period
Laß Pepi Neferkare gedeihen und Pepi Neferkare wird dich gedeihen lassen.,-2278,-2184,-2231,Middle Kingdom
"Was das Unheil vor dem Stier abtrennt, was die in der Finsternis erbeben läßt, (ist) das mächtige Horn, das hinter dem Großen Gott ist.",-2375,-2345,-2360,Middle Kingdom
dem das Erbe seines Vaters gegeben wurde.,-1759,-1630,-1695,New Kingdom
"Der Leiter der Pächterstellen des Palastes, Sechem-kai.",-2345,-2181,-2263,Middle Kingdom
"Ich richtete die Grenze ein, indem ich (weiter) nach Süden fuhr als meine (göttlichen) Vorväter.",-1837,-1819,-1828,New Kingdom
"Dein Sohn kommt zu dir, dieser Unas kommt zu dir.",-2375,-2345,-2360,Middle Kingdom
(Und) es gibt keinen Feiertag für den Habgierigen.,-1939,-1760,-1850,New Kingdom
Ihre Herzen fallen seinen Fingern anheim.,-2375,-2345,-2360,Middle Kingdom
"Ein Opfer, das der König gibt, ein Opfer, das Anubis, der vor der Gotteshalle ist, gibt:",-2345,-2181,-2263,Middle Kingdom
"Der 'Sohn der Erde' (Schlange) fällt also, seine Wirbelsäule unter ihm.",-2278,-2184,-2231,Middle Kingdom
Meine Finger hören nicht auf mich;,-1980,-1760,-1870,New Kingdom
Das ist ihr (d.h. der Götter) Gesetz für den von ihnen Geliebten.,-1939,-1760,-1850,New Kingdom
(Die Domäne) Meret-Heiligtum des Schepseskaf.,-2475,-2455,-2465,Middle Kingdom
"Unas ist aus seinem $ḏnj.t$-Krug herausgekommen, nachdem er in seinem $ḏnj.t$-Krug geschlafen/die Nacht verbracht hat.",-2375,-2345,-2360,Middle Kingdom
"Ein Opfer, das der König gibt, ein Opfer, das Osiris gibt:",-2345,-2323,-2334,Middle Kingdom
"Tausend an Brot, tausend an Bier, tausend an Alabaster-Gefäßen, tausend an Kleidung, tausend an Geflügel, tausend an Rind, tausend an weißer Säbelantilope.",-2494,-2181,-2338,Middle Kingdom
"Ich werde dich auf Vater Pepi Neferkares Scheitel setzen, wie Horus dich auf den Scheitel seines Vaters Osiris gesetzt hat.",-2278,-2184,-2231,Middle Kingdom
"Dein Same tritt heraus in sie, scharf als Sothis.",-2278,-2184,-2231,Middle Kingdom
"Der Vorsteher der Totenpriester, der Würdige Iren-Re.",-2494,-2181,-2338,Middle Kingdom
"(Du) vorn befindlicher, mehr als alle Götter,",-1759,-1630,-1695,New Kingdom
Das Bringen des Geschenkes - ein Steinbock.,-2487,-2475,-2481,Middle Kingdom
"Möge ihm ""Willkommen"" gesagt werden durch die Großen von Abydos im Wag-Fest, im Thot-Fest, im Fest des Sokar, beim Erscheinen des Min, beim Erscheinen des Sirius, beim Neujahresfest, bei jeden großen Fest, das für Osiris Chontamenti gemacht wird, den großen Gott, für den Ka des Generalissimus, Imeny.",-1878,-1843,-1861,New Kingdom
Nimm den Arm des Pepi Neferkare zum Himmel im Gefolge des Re!,-2278,-2184,-2231,Middle Kingdom
"Die Verwalterin des Königsvermögens, seine Ehefrau, seine Geliebte, Useret-ka.",-2494,-2345,-2420,Middle Kingdom
"Horus ist gekommen, damit er seinen Vater 'zähle', der du bist, verjüngt, in deinem Namen 'Verjüngtes Wasser'.",-2321,-2287,-2304,Middle Kingdom
Ein hoffnungsloser Fall ist das!,-1845,-1773,-1809,New Kingdom
Dein Natron ist das Natron des Thot.,-2278,-2184,-2231,Middle Kingdom
"Erhebe dich, Neith, und setz dich auf deinen ehernen Thron.",-2278,-2184,-2231,Middle Kingdom
"Osiris Unas, oh, möge (es, das Horusauge) für dich fortdauern bei dir, bei dir.",-2375,-2345,-2360,Middle Kingdom
"Unas ist der, der den Auftrag des Unwetters ausführt.",-2375,-2345,-2360,Middle Kingdom
ihr Blut ist für die zur Erde Gehörigen.,-2375,-2345,-2360,Middle Kingdom
"Der Priester des Anubis, der von der Gotteshalle der Wadjet, Balsamierer und Hüter des Geheimnisses Inpu-hetepu.",-2345,-2181,-2263,Middle Kingdom
Mögen ihm die beiden Arme in der Neschmet-Barke auf den Wegen des Westens gegeben werden.,-1878,-1843,-1861,New Kingdom
Dieser Vogel ist sehr fett.,-2345,-2181,-2263,Middle Kingdom
Die Opfer  des Cheops (Domäne).,-2487,-2475,-2481,Middle Kingdom
"für den sich die Großen und die Ältesten von ihren Matten erhoben haben,",-1689,-1688,-1689,New Kingdom
Die Östlichen in der Erde gehören diesem Unas.,-2375,-2345,-2360,Middle Kingdom
Der  Gutsvorsteher und Vorsteher der Totenpriester User-Inpu.,-2494,-2345,-2420,Middle Kingdom
Der Diener des Königs Seschemnefer.,-2487,-2421,-2454,Middle Kingdom
"Erde, verschlucke das, was aus dir hervorgekommen ist!",-2375,-2345,-2360,Middle Kingdom
"(Diagnose:) Dann sagst du daraufhin über ihn (d.h. den Patienten):
""Einer mit einer klaffenden Wunde in seinem Kopf, die bis zum Knochen reicht
– sein (Hirn-)Schädel ist gespalten –,
(wobei) er aus seinen Nasenlöchern/Nasenhöhlen und seinen Ohren blutet (wörtl.: Blut gibt),
(und wobei) er an Steifheit/Steifigkeit (wörtl.: Aufrichtung) in seinem Nacken leidet:
eine Krankheit, mit der ich kämpfen werde.""",-1580,-1539,-1560,Late Period
"Horus hat veranlaßt, daß du dir alle Götter in deinen Armen umfasst.",-2278,-2184,-2231,Middle Kingdom
"Osiris Unas, nimm dir das Horusauge, das er (Seth) weggenommen(?) hat.",-2375,-2345,-2360,Middle Kingdom
Sie wird ihr die Bas von Pi bringen und sie werden für sie die Bas von Hierakonpolis vereinigen.,-2278,-2184,-2231,Middle Kingdom
"Sei gegrüßt, Min, in Frieden!",-1759,-1630,-1695,New Kingdom
"(Schlange) 'Den seine Mutter abgewendet hat', (Schlange) 'Den seine Mutter abgewendet hat'!",-2375,-2345,-2360,Middle Kingdom
Die (Wasser-)Fülle des Unas ist im Opfergefilde.,-2375,-2345,-2360,Middle Kingdom
"Das Land ist unter dir in seiner Gänze, du hast es in Besitz genommen.",-2321,-2287,-2304,Middle Kingdom
Nicht soll er begraben werden in der Nekropole.,-2345,-2323,-2334,Middle Kingdom
Der leibliche Königssohn und Gottessiegler der Barke Mer-ib.,-2613,-2494,-2554,Middle Kingdom
"Ein Opfer, das der König und Osiris, der große Gott, Herr von Abydos an allen seinen schönen und reinen Plätzen, geben.",-1939,-1760,-1850,New Kingdom
Horus hat sein(es Vaters) leeres Auge mit seinem (eigenem) vollen Auge gefüllt.,-2278,-2184,-2231,Middle Kingdom
(Und) höre nicht auf das Verlangen (wörtl.: Herz)!,-1939,-1760,-1850,New Kingdom
"Du sollst ausfließen, schmerzhafter Kot,",-1818,-1630,-1724,New Kingdom
Zu wem werde ich heute sprechen?,-1939,-1760,-1850,New Kingdom
Gib ihn dir in deine Hand!,-2375,-2345,-2360,Middle Kingdom
"Seine Boten gehen, seine Eilboten laufen, seine Herolde eilen.",-2321,-2287,-2304,Middle Kingdom
"O du, dessen $ꜥꜣb$-Baum grünt, der auf seinem Feld ist!",-2278,-2184,-2231,Middle Kingdom
Dieser Unas hat sich im Binsengefilde gereinigt.,-2375,-2345,-2360,Middle Kingdom
Horus hat die Schenkel deiner Feinde ausgelöst;,-2321,-2287,-2304,Middle Kingdom
"Mögest du erhöht sein, Horus, Herr der Sehnet-Kapelle!",-1759,-1630,-1695,New Kingdom
"Atum wird dich nicht dem Osiris geben: dieser wird nicht dein Herz prüfen, er wird nicht über dein Herz Macht haben.",-2375,-2345,-2360,Middle Kingdom
"Die ihr gegen Unas als Widersacher kommen wollt, kommt zu ihm, kommt zu ihm!",-2375,-2345,-2360,Middle Kingdom
Dann mußt du ihm folglich $bḏꜣ$-Röllchen/Ballen(?) aus Leinenstoff (an)legen;,-1580,-1539,-1560,Late Period
"Unas ist zu seiner Schläfe gekommen, wie der Gott zu seiner Schläfe kam.",-2375,-2345,-2360,Middle Kingdom
"Ist er lebensvoll, ist dieser Unas lebensvoll.",-2375,-2345,-2360,Middle Kingdom
"(Behandlung:) Wenn du jene Wunde vorfindest,
indem ihre Naht sich lockert / gelöst hat,
(aber im Ergebnis noch) an den beiden Rändern seiner Wunde verbleibt,
dann musst du folglich für ihn $bḏꜣ$-Röllchen/Ballen(?) aus Leinenstoff herstellen.",-1580,-1539,-1560,Late Period
Der Priester des Horus von Lybien mit erhobenem Arm Seschemnefer.,-2487,-2421,-2454,Middle Kingdom
"Möge dein Geist verklärt sein, möge deine Macht mächtig sein in deiner Schönheit, in diesem deinem großen Abbild, in dieser deiner schönen Würde.",-1759,-1630,-1695,New Kingdom
Deine Beine sind Amset und Qebehsenuef:,-2321,-2287,-2304,Middle Kingdom
"Der(/Die) Verwalter(in) des Königsvermögens und Herr(in) der Ehrwürdigkeit, der(/die) Metallschmuck-Arbeiter(in) Nefer-seres.",-2494,-2181,-2338,Middle Kingdom
"Du bist zu deinem Ba gekommen, Osiris, Ba-mächtiger unter den Ach-Geistern, Mächtiger an seinen Plätzen, den die Neunheit im Fürstenhaus schützt.",-2278,-2184,-2231,Middle Kingdom
Pepi Neferkare's Mahlzeit ist wie (die des) Gottesschiffes.,-2278,-2184,-2231,Middle Kingdom
So sollst du dagegen machen:,-1845,-1773,-1809,New Kingdom
"Ein Opfer, das der König gibt, ein Opfer, das Anubis gibt: Ein Totenopfer für ihn als Speisenbedarf und Opferausstattung.",-2345,-2181,-2263,Middle Kingdom
Unas hat die Hanf(?)-Taue geknüpft.,-2375,-2345,-2360,Middle Kingdom
Mein Brandopferbecken wird(?) sich nicht verdunkeln.,-1939,-1630,-1785,New Kingdom
"Osiris Unas, nimm dir das Horusauge und verhindere, daß er (Seth) es ausreißt.",-2375,-2345,-2360,Middle Kingdom
Ich suche Osiris bei On.,-1920,-1843,-1882,New Kingdom
Die Gründung des Kai-ni-niswt (Domäne).,-2494,-2345,-2420,Middle Kingdom
"Nemti-em-za-ef Merenre isst keinen Körperteil von Osiris, so daß die Götter sagen könnten: ""Er stirbt deswegen.""",-2287,-2278,-2283,Middle Kingdom
Dann ist sein Gesicht infolgedessen breitgedrückt.,-1580,-1539,-1560,Late Period
"und er kennt die Anzahl der Iput-Kammern des $Wn.t$-Heiligtums des Thot.""",-1580,-1539,-1560,Late Period
"Der Versorgte beim großen Gott, der Aufseher der Totenpriester und Verwalter des Königsvermögens Ni-su.",-2345,-2181,-2263,Middle Kingdom
"(Denn) es gibt keinen, der weise geboren wurde.",-1939,-1760,-1850,New Kingdom
Das Bringen des Totenopfers seitens seiner Dörfer Unterägyptens an jeden Fest täglich für Seschat-hetepu.,-2487,-2475,-2481,Middle Kingdom
"Ein Opfer, das der König gibt, ein Opfer, das Anubis, der auf seinem Berg ist, der  vor der Götterhalle ist, der Balsamierer, gibt:",-2345,-2323,-2334,Middle Kingdom
"Möge man deinem ergebenen Diener (wörtl.: dem Diener dort) befehlen, einen Stab-des-Alters anzufertigen!",-1939,-1760,-1850,New Kingdom
"Mögest du seinen Weg an der Spitze der Achu bahnen, damit er an der Spitze der Achu stehe wie Anubis, der an der Spitze der Westlichen ist.",-2375,-2345,-2360,Middle Kingdom
(aber) (das) ist nicht nützlich/wirkungsvoll für dich.,-1939,-1760,-1850,New Kingdom
"Ein Opfer, das der König gibt, ein Opfer, das Anubis gibt:",-2494,-2345,-2420,Middle Kingdom
Der Vorsteher der Priester des Nemti und Hüter des Geheimnisses des Gottesschatzes in den Häuser von Mam Hem-Re.,-2345,-2287,-2316,Middle Kingdom
"(Indem/weil) deine Selbstbeherrschung seinen Reichtum ausgeglichen hat, wird er als: ""Es ist ein Ungebildeter!"" bezeichnet werden.",-1939,-1760,-1850,New Kingdom
"Dann musst du folglich mit Hilfe seiner Schultern (oder: im Bereich seiner Schultern) eine Ausbreitung/Spreizung vornehmen,
um seine Schlüsselbeine auszustrecken/auszudehnen (oder: sodass sich seine Schlüsselbeine ausdehnen),
sodass jener $ḥsb$-Bruch an seine (richtige) Stelle zurückfällt.",-1580,-1539,-1560,Late Period
"Tausend an Graugans, tausend an Bläßgans, tausend an Hedj-Gans.",-2494,-2181,-2338,Middle Kingdom
In jeder seiner Rede eiferte ich meinem Herrn nach.,-1548,-1539,-1544,Late Period
Ich möchte im Gefolge des Gottes sein um der Verklärtheit und Mächtigkeit an der Treppe des Herrn von Abydos willen.,-1818,-1773,-1796,New Kingdom
Die Greise und Greisinnen unter ihnen sind für seine Feuerung.,-2345,-2323,-2334,Middle Kingdom
"Daraufhin holte er es, und es wurde seiner Herrin gegeben.",-1580,-1539,-1560,Late Period
"Es ist (eine) Sachmet gegen den, der seinen Befehl übertritt.",-1818,-1773,-1796,New Kingdom
"In deinem Namen ""Der im südlichen $Wnw$ ist"".",-2375,-2345,-2360,Middle Kingdom
Rote Salbe (lit: rotes Vogelfett),-2842,-2800,-2821,Old Kingdom
"Sein Kind der Totenstiftung, der Totenpriester Anch-em-a-kai.",-2487,-2475,-2481,Middle Kingdom
"""Er kämpft, (nachdem) er den Ausgang (des Kampfes) (schon) vorausgesehen hat, (und) er wartet nicht auf das Weitere (den Rest)!""",-1939,-1760,-1850,New Kingdom
"Ein Totenopfer für ihn täglich, dem Königssohn Kai-ni-nisut.",-2494,-2345,-2420,Middle Kingdom
Geh fort und gebiete den Hügeln des Seth!,-2278,-2184,-2231,Middle Kingdom
"Ich rede, (und zwar damit) du hören wirst:",-1939,-1760,-1850,New Kingdom
Gib ihn dir in deine Hand!,-2375,-2345,-2360,Middle Kingdom
"(Anfang Teil A) und Priester von Horus-Anubis, der vor dem Haus des Geleites residiert",-2475,-2455,-2465,Middle Kingdom
"Tausend an Brot, tausend an Bier, tausend an Graugans, tausend an Rind, tausend an Alabastergegenstand, tausend an Kleidung (für) die Versorgte durch den Großen Gott, Herr des Himmels, Hetep(-Wadjet).",-2345,-2181,-2263,Middle Kingdom
"Iwa-Fleischknochen, Rippchen(braten), Gänsebraten, Sechepet-Getränk, Hedjet-Getränk.",-2589,-2566,-2578,Middle Kingdom
"Mögen die Achs, die im Wasser sind, ihn preisen.",-2375,-2345,-2360,Middle Kingdom
"Jener Mann, der schlecht gegen meinen Namen/Ruf gesprochen hat, ist gefallen wegen all dessen, was er in schlechter Weise gegen mich sagte.",-1759,-1630,-1695,New Kingdom
"Teti ist die Blüte, die als Ka hervorkam, die goldene Blüte, die aus Iseum hervorkam.",-2345,-2323,-2334,Middle Kingdom
Erweichen der $šw.t$ der Gefäße.,-1939,-1630,-1785,New Kingdom
Wie eine Nilgans hat Unas die Arme gebraucht;,-2375,-2345,-2360,Middle Kingdom
Der Königssohn und Gottessiegler der Barke Mer-ib.,-2613,-2494,-2554,Middle Kingdom
Mögest du dich im Horizont reinigen.,-2375,-2345,-2360,Middle Kingdom
Opfern von Brot und Bier in der Kapelle des Horus Za,-2800,-2650,-2725,Old Kingdom
"Der Vorsteher der Zehn der Barke, Vorsteher der Stätte des Palastes und Oberster der Libation Demeg.",-2345,-2181,-2263,Middle Kingdom
"Deine Hand ist von Re ergriffen worden, dein Kopf ist von den beiden Neunheiten hochgehoben worden.",-2321,-2287,-2304,Middle Kingdom
"Euer Duft kommt zu Unas, Götter; der Duft des Unas kommt zu euch, Götter.",-2375,-2345,-2360,Middle Kingdom
"Ich bin der, der selbst kommt!",-1980,-1939,-1960,New Kingdom
"(Wenn) du zerteilst, wer wird (dann wieder) zusammenfügen?",-1939,-1760,-1850,New Kingdom
"Chentischi an (der Pyramidenanlage) 'Die Vollkommenheit des Pepi dauert', Wab-Priester der Zweihundert und  Zimmermann der großen Werft, der Versorgte bei Djedef-Hor Iuef-en-Ptah.",-2345,-2181,-2263,Middle Kingdom
"(mit dem Ergebnis, daß) Stücke/Reste im Hautgewebe seines Kopfes verbleiben,
ohne daß (sie) zu Boden fallen (können).",-1580,-1539,-1560,Late Period
Geleitet von seinen Kas möge er aufsteigen zu dem Großen Gott.,-2345,-2181,-2263,Middle Kingdom
"Jemand ist zu seinem Ka gegangen: Osiris ist zu seinem Ka gegangen, Seth ist zu seinem Ka gegangen, Chenti-irti ist zu seinem Ka gegangen, Pepi ist zu seinem Ka gegangen.",-2321,-2287,-2304,Middle Kingdom
Er wird nicht sterben und dieser Unas wird nicht sterben.,-2375,-2345,-2360,Middle Kingdom
Der einzige Freund (des Königs) und Aufseher der Barke 'Ba-Netjeru' Kai-pu-nisut.,-2613,-2494,-2554,Middle Kingdom
Außerdem ist er benommen; er kann nicht sprechen.,-1580,-1539,-1560,Late Period
"Es kommt doch Der an der Spitze der Westlichen zu ihm, nachdem er Speisen und Opfer für (oder: des?) Horus, der an der Spitze der Häuser ist, geholt hat.",-2278,-2184,-2231,Middle Kingdom
"Ich bin Horus, Osiris Pepi Neferkare.",-2278,-2184,-2231,Middle Kingdom
"Thinitischer Gau (8. o.äg. Gau): Vorsteher (und zwar) Vorsteher der Festungen, Leiter des Landes, Aufseher der Königsleute, Vorsteher der Aufträge, Verwalter des großen Gutes; Wadjet (10. o.äg. Gau): Vorsteher (und zwar) Vorsteher der Aufträge, Vorsteher der Festungen, Aufseher der Königsleute, Leiter des Landes, Verwalter des großen Gutes; Östlicher Heqa-anedju-Gau: Vorsteher (und zwar) Aufseher der Sperren, Vorsteher der Wüstenregion, Vorsteher der Königsfestungen (und) Verwalter des Königsvermögens Nefer-nisut.",-2487,-2455,-2471,Middle Kingdom
"Du hast den 'Messer'-Kanal im Norden der Nut durchzogen als Stern, der das Große Grüne (Gewässer) unter dem Bauch der Nut durchquert.",-2321,-2287,-2304,Middle Kingdom
Seine Mutter Nut wird keinen Tag leer von ihm sein.,-2278,-2184,-2231,Middle Kingdom
"du wirst nichts tun gegen sie, was böse oder übel ist.",-1818,-1630,-1724,New Kingdom
"(So) holt man (gerade dennoch) die Vertrauten herbei, (wenn) eine Katastrophe geschieht.",-1939,-1760,-1850,New Kingdom
"Horus, der Jugendliche/Verjüngte(?), soll dich erkennen, verjüngt in diesem deinem Namen 'Verjüngtes Wasser'.",-2321,-2287,-2304,Middle Kingdom
"""Du selbst, Djedefhor, mein Sohn, mögest du ihn mir bringen!""",-1580,-1539,-1560,Late Period
(Titel:) Erfahrungswissen über einen $ḥsb$-Bruch an seinem Oberarm.,-1580,-1539,-1560,Late Period
"König von Ober- und Unterägypten, die beiden Herrinnen, Chasechemui",-2706,-2686,-2696,Old Kingdom
"(Wenn) du auf vollendeter Art sprichst/sprechen wirst, (dann) wird jeder Plan von dir an seiner (richtigen) Stelle sein.",-1939,-1760,-1850,New Kingdom
Ein Jungtier der weißen Säbelantilope.,-2494,-2345,-2420,Middle Kingdom
Die Mumienhülle sei von Gold.,-1939,-1760,-1850,New Kingdom
Der Stadtgott des Pepi wird erneut(?) hinter ihm stehen.,-2321,-2287,-2304,Middle Kingdom
"Unas ist 'Der auf seinem $wꜥ$(?)/in seinem Alleinsein(?) ist', der älteste der Götter.",-2375,-2345,-2360,Middle Kingdom
"Ein Opfer, das der König gibt, ein Opfer, das Anubis, der vor der Gotteshalle ist, gibt:",-2345,-2181,-2263,Middle Kingdom
"Die Priesterin der Hathor, Priesterin der Neith (und) Verwalterin des Königsvermögens Chenti.",-2487,-2455,-2471,Middle Kingdom
"Du bist rein, dein Ka ist rein, deine Macht unter den Verklärten ist rein, dein Ba unter den Göttern ist rein.",-2321,-2287,-2304,Middle Kingdom
Du wirst deinen Arm ihnen entgegenstrecken und sie werden zu dir in Verneigung kommen.,-2287,-2278,-2283,Middle Kingdom
"Der Verwalter des Königsvermögens, Senior-Schreiber und Aufseher der Totenpriester Weri.",-2345,-2181,-2263,Middle Kingdom
(er) wird wirklich sehr zittern (?) (oder: (es) wird wirklich sehr wackeln/nachgeben (? –;,-1580,-1539,-1560,Late Period
Er ist mit dem Horusauge herausgekommen.,-2375,-2345,-2360,Middle Kingdom
"Herr des Ansehens, groß in Herakleopolis,",-1707,-1688,-1698,New Kingdom
(Abgaben von) Ober- und Unterägypten: Lieferung von ḥm-ꜥꜣ-Holz,-2842,-2800,-2821,Old Kingdom
"Es gibt keinen mit (jetzt noch) abgestumpften Sinnen (wörtl.: mit zerhackten Gesichtern), den du scharf(sinnig) gemacht hast.",-1939,-1760,-1850,New Kingdom
"(indem/wobei) er an Steifheit/Steifigkeit (wörtl.: Aufrichtung) in seinem Nacken leidet,",-1580,-1539,-1560,Late Period
"Du sollst auf einem ehernen Thron sitzen, dein Vorderteil (das) ein(es) Schakal(s), dein Hinterteil (das) ein(es) Falke(n), und dir Keule von der Schlachtbank des Osiris und zwei Rippenstücke von der Schlachtbank des Seth (zu Munde) führen.",-2321,-2287,-2304,Middle Kingdom
"Er möge sehr friedlich wandeln auf den schönen Wegen des Westens, der einzige Freund des Königs, Leiter der beiden Throne, Seschem-nefer Tjeti.",-2345,-2181,-2263,Middle Kingdom
Kammer des Tempels der beiden Herrinnen,-2800,-2780,-2790,Old Kingdom
"Verhüte, dass es vertilgt wird.",-2278,-2184,-2231,Middle Kingdom
Ihm mögen die Verklärungen durch den Vorlesepriester gegeben werden.,-2345,-2323,-2334,Middle Kingdom
"Lebt er, lebt dieser Unas.",-2375,-2345,-2360,Middle Kingdom
"Möge Isis nach dir rufen, möge Nephthys dir zurufen wie Horus, der seinen Vater Osiris schützt.",-2278,-2184,-2231,Middle Kingdom
"Der Große ist auf seine Seite gefallen, der in Nedit bewegt sich.",-2278,-2184,-2231,Middle Kingdom
Die Gründung des Ray (Domäne).,-2494,-2345,-2420,Middle Kingdom
Sie sind die Herren des Guten.,-1939,-1760,-1850,New Kingdom
Mein Herz war nicht mehr in meinem Leibe.,-1939,-1760,-1850,New Kingdom
"Sein ältester Sohn, der Senior-Aufseher der Schreiber Ptah-hetepu.",-2345,-2181,-2263,Middle Kingdom
"Da sagte seine Majestät: ""Er soll nicht in Furcht sein!""",-1939,-1760,-1850,New Kingdom
"Sein Fest (oder: seine Trauer?) ist nahe, nachdem er das Aufziehen der Finsternis des Nordwindes (d.h. die dunklen Wolken eines Nordsturms?) gesehen hat, (weil) er auf dem Schiff wachsam ist.",-1939,-1760,-1850,New Kingdom
"(Als) das Land sich aber erhellte, sehr früh des Morgens, kam ein Ruf zu mir.",-1939,-1760,-1850,New Kingdom
"$Bꜣbj$ steht da, nachdem er sich dem Vordersten von Letopolis genähert hat.",-2375,-2345,-2360,Middle Kingdom
Es werde von der Frau geschluckt.,-1818,-1630,-1724,New Kingdom
"Osiris Neith, nimm dir das Horusauge, das er heil gemacht hat.",-2278,-2184,-2231,Middle Kingdom
"Du bist Gebs Sohn, du wirst nicht sterben.",-2278,-2184,-2231,Middle Kingdom
"Osiris Neith, Horus hat dich geschützt.",-2278,-2184,-2231,Middle Kingdom
"wobei sie (d.h. die Zehenspitzen) gehen, indem sie den Boden suchen.",-1580,-1539,-1560,Late Period
Jeder Gott ist unter deiner Liebe.,-1759,-1630,-1695,New Kingdom
Deine Schwester ist die Carob.,-1980,-1760,-1870,New Kingdom
"Er möge geben Verklärtheit, Macht, Rechtfertigung, den süßen Hauch des Lebens für den Ka des Vorstehers der Stätte, Senebi.",-1759,-1630,-1695,New Kingdom
Gemäß seinem Willen handelt (ja) deine Majestät!,-1939,-1760,-1850,New Kingdom
"Der Vorsteher der Häuser der Königskinder, Wab-Priester des Königs, der Würdenträger und Mannschaftsschreiber Kai-pu-nisut.",-2494,-2345,-2420,Middle Kingdom
"Aus einem, der in elenden Zustand versetzt worden ist, wird ein Widersacher.",-1939,-1760,-1850,New Kingdom
"(Denn) mein Weg sollte/möge gut sein.""",-1939,-1760,-1850,New Kingdom
(Behandlung:) Es gibt nichts (oder: Es ist nichts (da im Manuskript.,-1580,-1539,-1560,Late Period
Der Verwalter des Königsvermögens Nefer.,-2494,-2181,-2338,Middle Kingdom
Der von seinem Herrn Geliebte Seschemnefer.,-2487,-2421,-2454,Middle Kingdom
"Ein Opfer, das der König gibt, ein Opfer, das Anubis gibt:",-2686,-2161,-2424,Middle Kingdom
"Unas hat auf euch geschaut, wie Seth auf die beiden Einträchtigen schaute.",-2375,-2345,-2360,Middle Kingdom
Horus hat dich geleitet und er hat dich geliebt.,-2287,-2278,-2283,Middle Kingdom
"Der Vorsteher der Chentuschi am Palast, Senior-Verwalter des Palastes, Vorsteher der Chentuschi am Palast und Versorgter beim großen Gott Imi-set-kai.",-2161,-1980,-2071,New Kingdom
"Der Wab-Priester des Königs, Aufseher der Schreiber des Königsleinens und Verwalter des Königsvermögens Ii-mery.",-2345,-2181,-2263,Middle Kingdom
"Er möge bestattet sein in der wetlichen Wüste als Herr der Ehrwürdigkeit beim großen Gott, der Älteste des Hauses Meni.",-2345,-2181,-2263,Middle Kingdom
"Mit gehört das Sema-Land(?), auf dem er/es gewachsen ist(?).",-1939,-1630,-1785,New Kingdom
Er möge geführt werden durch seine Ka's.,-2345,-2323,-2334,Middle Kingdom
"Auf dein Gesicht, du, der in seinem $nꜣw.t$-Busch ist!",-2278,-2184,-2231,Middle Kingdom
Möge sie dir deine Knochen vereinigen.,-2321,-2287,-2304,Middle Kingdom
Aller Alabaster und alle Kleidung - zweitausend (Einheiten) - Rind (und) Gans.,-2345,-2181,-2263,Middle Kingdom
(Es) werde durch und durch und gründlich gekocht.,-1580,-1539,-1560,Late Period
"Du sollst aufstehen in deiner Stärke und tun, was du früher zu tun pflegtest.",-2321,-2287,-2304,Middle Kingdom
Der Aufseher der Schreiber der Königsakten des Schatzhauses und Aufseher der Schreiber des königlichen Seschep-Gewandes Ii-mery.,-2345,-2181,-2263,Middle Kingdom
Ich habe meine Furcht zu Boden gelegt.,-1759,-1630,-1695,New Kingdom
"Ein Totenopfer für ihn am Abedu (Fest am 2. Tag nach Neumond), Semdet (Halbmonatsfest am 15. Tag des Monats) und jedem Fest, täglich.",-2494,-2181,-2338,Middle Kingdom
"Der Gott ist es, der die Stellung befördert.",-1939,-1760,-1850,New Kingdom
"das Tor der Fremdländer, 
Neheri's Sohn, Chnumhoteps (II.) Sohn, Chnumhotep (III.), geboren von der Hausherrin Cheti.",-1878,-1837,-1858,New Kingdom
"Lege dir das Horusauge an, nimm es dir, auf dich, damit es sich dir anschmiege, damit es sich deinem Körper anschmiege.",-2321,-2287,-2304,Middle Kingdom
